no_acclimation,genus,species,phylum,class,order,family,life_stage,age_maturity_days_female,age_maturity_days_female_reference,age_maturity_days_male,age_maturity_days_male_reference,age_maturity-days_unknown_sex,dispersal_distance_category,logic_source_for_dispersal_distance,dispersal_distance2_category,logic_source_for_dispersal_distance2,maximum_body_size_svl_hbl_cm,source_for_maximum_body_size,average_body_size_female,average_body_size_female_reference,average_body_size_male,average_body_size_male_reference,average_body_size_unknown_sex,season_inactive,logic_source_for_season_inactive,migratory,source_logic_for_migration_info,season_when_away_10km+ (migratory only),season_when_away_100km+ (migratory only),logic_source_season_when_away,Home range size_Km2,logic-source_for_Home range size,data_gatherer,lifespan_days,lifespan_days_reference,Notes
no,Canthon,humectus,Arthropoda,Insecta,Coleoptera,Scarabaeidae,adults,unk,,unk,,,100+,MOVEMENT: flies at a speed of 30 kmh and is reported to be able to fly under a wide range of ambient temperatures+ making it likely that it can disperse over large distances (http://www.biogeografia.org/trabajospdf/2008.%20Verdu%20&%20Lobo.%20Ecophysiology%20of%20thermoregulation%20in%20endothermic%20dung%20beetles.%20In%20Insect%20Ecology%20and%20Conservation.pdf) ,,,1.7,total body length 10.0–17.0 mm (http://idtools.org/id/beetles/scarab/factsheet.php?name=15177),,,,,,kunk,https://www.researchgate.net/publication/264953522_The_Role_of_Canthon_humectus_hidalgoensis_Bates_Coleoptera_Scarabaeidae_in_Dung_Removal_from_a_Cattle_Pasture ,non-migratory,IUCN Red List,NA,NA,NA,unk,,Wilco+Piero,730,can live more than two years (https://doi.org/10.1016/j.jaridenv.2010.09.010),
no,Gayralia,sp,Chlorophyta,Ulvophyceae,Ulvales,Monostromataceae,thallus,NA,,,,,NA,NA, ,,NA,NA,,,,,,,,NA,NA,,,,,,,,,
no,Anguilla,australis,Chordata,Actinopterygii,Anguilliforme,Anguillidae,elvers,6570,18-24 years (https://fishesofaustralia.net.au/),5110,14 years (https://fishesofaustralia.net.au/),,100+,"LARVAL: larval transport duration is 7-8 months (IUCN Red List)
MIGRATION: 3715 m linear distance travelled during ontogenetic migration (10.1111/j.1095-8649.1979.tb03557.x)",,,130,TL male/unsexed - fishbase,,,,,,none,no dormancy reported,non-migratory,IUCN Red List,NA,NA,"ontogenetic migrant
DISTANCE: 3000km+ (https://doi.org/10.3389/fphys.2015.00256 )
TIMING: catadromous eel+ spawn once before death+ age at spawning migration varies depending on growth rate+ occurs in late summer to early autumn (IUCN Red List)",0.5,of the eels recaptured in the study 81% were within 400m of initial capture site+ treated as radius (Beumer 1979) (adults),Sarah/Nikki,11680,32 years max (AnAge),
no,Anguilla,dieffenbachii,Chordata,Actinopterygii,Anguilliformes,Anguillidae,larvae,11315,Figure 1 (Doole 2005) - DOI: 10.1111/j.1467-8489.2005.00310.x,4380,Figure 1 (Doole 2005) - DOI: 10.1111/j.1467-8489.2005.00310.x,,100+,LARVAL: PLD 17 months+ disperses from ocean habitat to freshwater as a larvae over 17 months+ passive dispersal (McDowall+ R. M. (1990). and migrate as far as 5000-6000km to spawn),,,182,TL male/unsexed -fishbase,,,,,,none,no dormancy reported,non-migratory,IUCN Red List,NA,NA,"ontogenetic migration
DISTANCE: between 2000-5000km (DOI: 10.1007/s10695-010-9397-4)
TIMING: catadromous eel+ end of life+ occurs within a two to three-month period+ females migrate between (April-June) 
juvenile migration takes place during first 17 months (https://www.fishbase.se/summary/Anguilla-dieffenbachii.html + iUCN Redlist)",0.062,species in the adult stage have very limited home ranges+ all recaptured eels were within 140 meters of their original capture site+ treated as radius (Chisnall & Kalish 2013),Sarah/Nikki,18980,Department of conservation New Zealand (between 35 to 52 years),
no,Apogon,pacificus,Chordata,Actinopterygii,NA,Apogonidae,NA,unk,,unk,,,0-1,mouthbrooding (IUCN redlist),,,10,TL male/unsexed -fishbase,,,,,,none,tropical fish (fishbase),unk,NA,NA,NA,NA,unk,,Nikki,unk,,Synonym: Apogon/minorus parri (https://www.researchgate.net/profile/Thomas_Fraser5/publication/305671401_A_new_genus_and_species_of_cardinalfish_Percomorpha_ApogonidaeSphaeramiini_from_the_coastal_waters_of_Vietnam_Luminescent_or_not/links/579b3e1c08ae2e0b31b354b3/A-new-genus-and-species-of-cardinalfish-Percomorpha-Apogonidae-Sphaeramiini-from-the-coastal-waters-of-Vietnam-Luminescent-or-not.pdf) pg. 348 of Galapagos fishes book from lib
no,Chaenocephalus,aceratus,Chordata,Actinopterygii,Perciformes,Channichthyidae,NA,3650,10 years+ figure 9 (https://digitalcommons.odu.edu/cgi/viewcontent.cgi?article=1317&context=oeas_fac_pubs),3650,10 years+ figure 9 (https://digitalcommons.odu.edu/cgi/viewcontent.cgi?article=1317&context=oeas_fac_pubs),,100+,LARVAL: PLD of 1 year (doi: 10.1111/mec.12612) ,,,72,TL male/unsexed -fishbase,,,,,,none,no dormancy reported,migratory,http://nora.nerc.ac.uk/id/eprint/775/1/Reid_et_al._Scotia_Sea_icefish_revised_textfigs.pdf,autumn,autumn,"DISTANCE: ~800km computed from fig 1 (https://doi.org/10.1111/j.1365-2699.2011.02682.x)
TIMING: autumn (https://doi.org/10.1111/j.1365-2699.2011.02682.x)
MORE DETAILED TIMING: latitudinal trend - one or more months later in the more southerly South Orkney Islands and the Antarctic Peninsula region in comparison to South Georgia (https://doi.org/10.1007/s00300-005-0010-8)",unk,,Nikki,7300,approach and exceed 15-20 years (https://www.researchgate.net/profile/Allen_Andrews2/publication/328797809_Feasibility_of_lead-radium_dating_the_otoliths_of_blackfin_icefish_Chaenocephalus_aceratus_and_ocellated_icefish_Chionodraco_rastrospinosus/links/5be3821892851c6b27aee5ad/Feasibility-of-lead-radium-dating-the-otoliths-of-blackfin-icefish-Chaenocephalus-aceratus-and-ocellated-icefish-Chionodraco-rastrospinosus.pdf),
no,Chionodraco,rastrospinosus,Chordata,Actinopterygii,Perciformes,Channichthyidae,NA,1460,4 years for both sexes 10.1007/s00300-008-0471-7,1460,10.1007/s00300-008-0471-7,,100+,LARVAL: PLD of 1 year + (https://doi.org/10.1111/j.1365-2699.2011.02682.x),,,52,TL male/unsexed -fishbase+ 10.1007/s00300-008-0471-7,47.9,TL 10.1007/s00300-008-0471-7,42.9,TL 10.1007/s00300-008-0471-7,,none,no dormancy reported,non-migratory,no migration in life history description (https://doi.org/10.1111/j.1365-2699.2011.02682.x) ,NA,NA,NA,unk,,Nikki,3650,"""may approach or exceed 10 years"" (https://www.researchgate.net/profile/Allen_Andrews2/publication/328797809_Feasibility_of_lead-radium_dating_the_otoliths_of_blackfin_icefish_Chaenocephalus_aceratus_and_ocellated_icefish_Chionodraco_rastrospinosus/links/5be3821892851c6b27aee5ad/Feasibility-of-lead-radium-dating-the-otoliths-of-blackfin-icefish-Chaenocephalus-aceratus-and-ocellated-icefish-Chionodraco-rastrospinosus.pdf)",
no,Cirrhitichthys,oxycephalus,Chordata,Actinopterygii,Perciformes,Cirrhitidae,NA,unk,,unk,,,100+,LARVAL: PLD mean of 51 days (https://media.nature.com/original/nature-assets/ncomms/2014/141121/ncomms6575/extref/ncomms6575-s2.docx),,,10,TL male/unsexed -fishbase,,,,,,none,tropical fish (fishbase),non-migratory,"""non-vagile and demersal"" implies little movement ability (https://doi.org/10.1007/s002270100626) and no mention of migration in life history (Grove+ J. S.+ & Lavenberg+ R. J. (1997). The fishes of the Galápagos islands. Stanford University Press.)",NA,NA,NA,unk,,Nikki,2920,3-8 years+ not the best source... (http://www.theaquariumwiki.com/wiki/Cirrhitichthys_oxycephalus),
no,Culaea,inconstans,Chordata,Actinopterygii,Gasterosteiformes,Gasterosteidae,NA,365,1 year http://www.ontariofishes.ca/fish_detail.php?FID=119,365,http://www.ontariofishes.ca/fish_detail.php?FID=119,Y,1-10,"MOVEMENT: maximum distance between captures of 181m but 7/250 recaptured so authors suggests low site fidelity (https://doi.org/10.1016/S0380-1330(05)70299-9)
LARVAL: eggs deposited and fry hatch in nests+ so small larval dispersal (Fish life history and habitat use in the Northwest Territories: brook stickleback (Culaea inconstans))  
MIGRATION: move at least 10km downstream as adult (https://doi.org/10.1577/1548-8659(1977)39[14:DMOFIA]2.0.CO;2)",,,8.7,TL male/unsexed -fishbase,5,TL male/unsexed - fishbase,5,TL male/unsexed - fishbase,Y,none,no dormancy reported,non-migratory,IUCN Red List,NA,NA,NA,unk,,Nikki,1095,2-3 years (fishbase+ http://www.ontariofishes.ca/fish_detail.php?FID=119),
no,Bathygobius,soporator,Chordata,Actinopterygii,Perciformes,Gobiidae,NA,346,Earliest reproduction seen in individual of 40 mm (Tavolga+ W - Reproductive behavior in the gobiid fish Bathygobius soporator+) COMBINED WITH equation for growth from DOI: 10.18785/negs.0602.07,346,Earliest reproduction seen in individual of 40 mm (Tavolga+ W - Reproductive behavior in the gobiid fish Bathygobius soporator+) COMBINED WITH equation for growth from DOI: 10.18785/negs.0602.07,Y,10-100,LARVAL: PLD 26-31 days+ then transition to benthic habitat (https://doi.org/10.18785/negs.0602.07),,,15,TL male/unsexed -fishbase,,,,,,none,tropical fish (fishbase),non-migratory,Fishbase,NA,NA,NA,unk,,Nikki,1204.5,calculated tmax of 3.3 years (Niyonkuru+ C.+ Lalèyè+ A. P.+ Villanueva+ M. C. S.+ & Moreau+ J. (2007). Population parameters of main fish species of Lake Nokoué+ Bénin+ West Africa. In Journal of Afrotropical Zoology+ Proceedings of the Third International Conference on Africa Fish and Fisheries+ Cotonou+ Benin+ 10–14 November 2003+ Special issue (pp. 149-155).),
no,Coryphopterus,urospilus,Chordata,Actinopterygii,Perciformes,Gobiidae,NA,84,Settles after 60 days+ female matures 24 days later (Victor+ Benjamin & Vásquez-Yeomans+ Lourdes & Valdez-Moreno+ Martha & Wilk+ Leslie & Jones+ David & Lara+ Monica & Caldow+ Chris & Shivji+ Mahmood. (2010). The larval+ juvenile+ and adult stages of the Caribbean goby+ Coryphopterus kuna (Teleostei: Gobiidae): a reef fish with a pelagic larval duration longer than the post-settlement lifespan. Zootaxa. 2346. 53-61. ),105,Settles after 60 days+ male matures minimum 45 days later (Victor+ Benjamin & Vásquez-Yeomans+ Lourdes & Valdez-Moreno+ Martha & Wilk+ Leslie & Jones+ David & Lara+ Monica & Caldow+ Chris & Shivji+ Mahmood. (2010). The larval+ juvenile+ and adult stages of the Caribbean goby+ Coryphopterus kuna (Teleostei: Gobiidae): a reef fish with a pelagic larval duration longer than the post-settlement lifespan. Zootaxa. 2346. 53-61. ),,unk,estimate of PLD based on closely related species is around 60 days = 100+ category (The larval+ juvenile+ and adult stages of the Caribbean goby+ Coryphopterus kuna (Teleostei: Gobiidae): a reef fish with a pelagic larval duration longer than the post-settlement lifespan),,,6.5,TL male/unsexed -fishbase,,,,,,none,tropical fish (fishbase),non-migratory,"""non-vagile and demersal"" implies little movement ability (https://doi.org/10.1007/s002270100626) and no mention of migration in life history (Grove+ J. S.+ & Lavenberg+ R. J. (1997). The fishes of the Galápagos islands. Stanford University Press.)",NA,NA,NA,unk,,Nikki,unk,,
no,Halichoeres,dispilus,Chordata,Actinopterygii,Perciformes,Labridae,NA,unk,,unk,,,100+,LARVAL: PLD mean 39.4 days (DOI: 10.3354/meps205241) ,,,25,TL male/unsexed -fishbase,,,,,,none,tropical fish (fishbase),unk,NA,NA,NA,NA,unk,,Nikki,1825,"""Most reef wrasses have a lifespan of between three and five years."" estimate based on family (https://www.mexican-fish.com/wrasse-family/ + https://animaldiversity.org/accounts/Labridae/)",
no,Thalassoma,lucasanum,Chordata,Actinopterygii,Perciformes,Labridae,NA,unk,,unk,,,100+,LARVAL: PLD range 51-86 days (https://doi.org/10.1007/BF00349176),,,15,TL male/unsexed -fishbase,,,,,,none,tropical fish (fishbase),non-migratory,migrate only to downstream end of reef to spawn+ less than 10km (DOI: 10.2307/1444666),NA,NA,NA,unk,,Nikki,1825,"""Most reef wrasses have a lifespan of between three and five years."" estimate based on family (https://www.mexican-fish.com/wrasse-family/ + https://animaldiversity.org/accounts/Labridae/)",protogynous with no info on age at maturity
no,Lutjanus,guttatus,Chordata,Actinopterygii,Perciformes,Lutjanidae,NA,365,1-3 years (Characteristics of population dynamics of Lutjanus guttatus (Pisces: Lutjanidae) in Bufadero Bay+ Michoacán+ Mexico),365,1-3 years (Characteristics of population dynamics of Lutjanus guttatus (Pisces: Lutjanidae) in Bufadero Bay+Michoacán+ Mexico),Y,10-100,LARVAL: PLD of 24.1-24.7 days (DOI: 10.3354/meps230295),,,80,TL male/unsexed -fishbase,,,,,,none,tropical fish (fishbase),non-migratory,"""groundfish with no extensive migration"" (10.3109/19401736.2015.1115851)",NA,NA,NA,unk,,Nikki,8395,23 years as tmax (https://www.redalyc.org/pdf/339/33913148009.pdf),
no,Poecilia,mexicana,Chordata,Actinopterygii,Cyprinodontiformes,Poeciliidae,NA,210,7-12 months (Fishbase),210,7-12 months (Fishbase),Y,unk,LARVAL: lecithotropic (https://doi.org/10.1890/09-1008.1),,,11,SL male/unsexed - fishbase ,,,,,,none,tropical fish (fishbase),non-migratory,IUCN Red List,NA,NA,NA,0.000032,home range defined as an 8x4 m field pool in an experiment (https://doi.org/10.1007/BF00005456),Nikki,1825,3-5 years but not the best source (http://www.theaquariumwiki.com/wiki/Poecilia_mexicana),
,Acris,crepitans,Chordata,Amphibia,Anura,NA,Adult,365,1 year (amphibio),365,1 year (amphibio),Y,1-10,moved up to 1.3km (amphibiaweb),,,3.8,SVL - amphibio,,,,,,winter,overwinter in microhabita+ active all year except midwinter in the north (amphibiaweb + ADW),non-migratory,taxa,NA,NA,NA,kunk,AmphibiaWeb,Nikki,1788.5,4.9 years max+ 4 month average (amphibio),
,Ambystoma,jeffersonianum,Chordata,Amphibia,Caudata,Ambystomatidae,Adult,730,2-3 years (amphibio),730,2-3 years (amphibio),Y,0-1,The original dispersal values aer 250–1+600 m. I selected the 0-1km dispersal distance caetgory to reflect that likely most dispersal is happening at distances < 1km. Source AMphiweb+ Douglas and Monroe 1981),,,21,TL - amphibio,,,,,,winter+dry,burrows below the frost line and during dry weather (AmphibiaWeb),non-migratory,taxa,NA,NA,NA,0,mean 92.8m distance travelled from breeding pool over 164 days+ used as radius (https://doi.org/10.1670/155-02A),Ilona/Nikki,2190,6 years or longer (https://animaldiversity.org/accounts/Ambystoma_jeffersonianum/),
,Ambystoma,macrodactylum,Chordata,Amphibia,Caudata,Ambystomatidae,adult,365,1-3 years (amphibio),365,1-3 years (amphibio),Y,1-10,Funk+ W. C. and Dunlap+ W. W. 1999. Colonization of high-elevation lakes by long-toed salamanders (Ambystoma macrodactylum ) after the extinction of introduced trout populations.   Can. J. Zool. 77: 1759 -1767,,,24.8,TL - amphibio+ 5.5 from (Russell+ A.P. and G.L. Powell and D.R. Hall. 1996. Growth and age of Alberta long-toed salamanders (Ambystoma macrodactylum krausei): a comparison of two methods of estimation. Canadian Journal of Zoology 74:397䳱412.),,,,,,winter,probably hibernate terrestrially (AmphibiaWeb),non-migratory,taxa,winter,NA,NA,0.0001156-0.0002816,115.6 m2 for females+ 167.5 m2 for males+ and 281.6 m2 for juveniles (amphibiaweb),Micky/Ilona/Nikki,3650,10 years max (amphibio),
,Ambystoma,maculatum,Chordata,Amphibia,Caudata,Ambystomatidae,unknown,730,2-3 years (amphibio),730,2-3 years (amphibio),Y,0-1,Madison+ D. M. 1997. The emigration of radio-implanted spotted salamanders+ Ambystoma maculatum .  J. Herpetol. 31: 542 -551.,,,24.8,TL - amphibio,,,,,,winter+hot,hibernate in subterranean burrows and likely keep from freezing by moving below the frost line+ above their critical thermal maximum (34.9–35.8 ˚C; Gatz+ 1971+ 1973b) and will usually seek refuge from heat and desiccation in small mammal burrows (amphibiaweb),non-migratory,taxa,winter,NA,NA,0.000008-0.0000015 ,8-15m2 (https://animaldiversity.org/accounts/Ambystoma_maculatum/),Micky/Ilona/Nikki,11680,32 years max (amphibio) - AmphibiaWeb,
,Ambystoma,tigrinum,Chordata,Amphibia,Caudata,NA,larva,1460,AnAge,1460,AnAge,,0-1,longest recorded distance moved from a wetland is 229 m+ all movements within 300m in capture-recapture experiment (Amphibiaweb + DOI: 10.2307/1447434),,,33,TL - amphibio,,,,,,winter,overwinter by burrowing below the frost line (AmphibiaWeb),non-migratory,taxa,NA,NA,NA,0.071,kunk by amphibiaweb+ less than 300m in radius based on (DOI: 10.2307/1447434),Ilona/Nikki,9125,25 years max (Nigrelli 1954+ Petranka 1998; AmphibiaWeb),
no,Lagopus,lagopus,Chordata,Aves,Galliformes,Phasianidae,adult,365,AnAge,365,AnAge,,10-100,"MOVEMENT: maximum movement recorded in study over 4 seasons was 12+000m of a juvenile and adults show site fidelity once territory established (https://doi.org/10.1111/j.1365-2664.2005.01031.x)
another study found max 39km (https://doi.org/10.1002/jwmg.650)",,,43,28-43cm long (https://animaldiversity.org/accounts/Lagopus_lagopus/),,,,,,none,no dormancy reported,non-migratory,IUCN Red List,NA,NA,NA,0.02-0.12,defend a small breeding area of 2–12 ha once adult (https://doi.org/10.1111/j.1365-2664.2005.01031.x),Brad/Ilona/Nikki,3285,AnAge/Fransson et al. (2010) EURING list of longevity records for European birds,
no,Laudakia,stellio,Chordata,Lepidosauria,Squamata,Agamidae,unknown,730,2-3 years (Ergül Kalayci+ Tuba & Özdemir+ Nurhayat & Gül+ Çiğdem & Tosunoğlu+ Murat. (2014). Variation in Body Size and Age Structure of Stellagama stellio (L.+ 1758) (Reptilia: Agamidae) from Turkey. Acta Zoologica Bulgarica. 66. 65-72. ),730,2-3 years (Ergül Kalayci+ Tuba & Özdemir+ Nurhayat & Gül+ Çiğdem & Tosunoğlu+ Murat. (2014). Variation in Body Size and Age Structure of Stellagama stellio (L.+ 1758) (Reptilia: Agamidae) from Turkey. Acta Zoologica Bulgarica. 66. 65-72. ),Y,unk,could guess based on limited movement in behaviour (https://doi.org/10.1080/09397140.2013.810875),,,13.314,SVL (Ergül Kalayci+ Tuba & Özdemir+ Nurhayat & Gül+ Çiğdem & Tosunoğlu+ Murat. (2014). Variation in Body Size and Age Structure of Stellagama stellio (L.+ 1758) (Reptilia: Agamidae) from Turkey. Acta Zoologica Bulgarica. 66. 65-72. ),8.624-13.043,SVL (Ergül Kalayci+ Tuba & Özdemir+ Nurhayat & Gül+ Çiğdem & Tosunoğlu+ Murat. (2014). Variation in Body Size and Age Structure of Stellagama stellio (L.+ 1758) (Reptilia: Agamidae) from Turkey. Acta Zoologica Bulgarica. 66. 65-72. ),9.005-13.314,SVL (Ergül Kalayci+ Tuba & Özdemir+ Nurhayat & Gül+ Çiğdem & Tosunoğlu+ Murat. (2014). Variation in Body Size and Age Structure of Stellagama stellio (L.+ 1758) (Reptilia: Agamidae) from Turkey. Acta Zoologica Bulgarica. 66. 65-72. ),,none,no dormancy reported,non-migratory,not many lizards migrate and seeminly fewer more than 10km (https://doi.org/10.1007/s00360-009-0415-8),NA,NA,NA,unk,,Nikki,3650,10 years max (https://s3.amazonaws.com/academia.edu.documents/39486774/Variation_in_Body_Size_and_Age_Structure20151028-29725-jbqwzu.pdf?response-content-disposition=inline%3B%20filename%3DVariation_in_Body_Size_and_Age_Structure.pdf&X-Amz-Algorithm=AWS4-HMAC-SHA256&X-Amz-Credential=AKIAIWOWYYGZ2Y53UL3A%2F20200127%2Fus-east-1%2Fs3%2Faws4_request&X-Amz-Date=20200127T171058Z&X-Amz-Expires=3600&X-Amz-SignedHeaders=host&X-Amz-Signature=f918a1306b0966523d1cb215bf8831a8043131a97d4022cc971f7d9a751b1c60),
no,Anolis,cybotes,Chordata,Lepidosauria,Squamata,Iguanidae,adults,unk,45mm (http://www.anoleannals.org/wp-content/uploads/2011/06/licht-and-gorman-1970-u-of-ca-zool.pdf),unk,52mm (http://www.anoleannals.org/wp-content/uploads/2011/06/licht-and-gorman-1970-u-of-ca-zool.pdf),,0-1,MOVEMENT: little movement within home range and scape behaviour movement a few m (https://www.researchgate.net/profile/Robert_Powell6/publication/289169020_Natural_history_of_Anolis_cybotes_Sauria_Polychridae_from_an_altered_habitat_in_Barahona_Dominican_Republic/links/5ada3ea6a6fdcc2935884957/Natural-history-of-Anolis-cybotes-Sauria-Polychridae-from-an-altered-habitat-in-Barahona-Dominican-Republic.pdf),,,20.3,20.3cm SVL (A Field Guide to Reptiles & Amphibians: Eastern and Central North America By Roger Conant+ Joseph T. Collins),4.8,SVL (https://doi.org/10.1098/rspb.2009.2323),6.09,SVL (https://doi.org/10.1098/rspb.2009.2323),,none,no dormancy reported,non-migratory,none mentioned in life history (https://www.researchgate.net/profile/Robert_Powell6/publication/289169020_Natural_history_of_Anolis_cybotes_Sauria_Polychridae_from_an_altered_habitat_in_Barahona_Dominican_Republic/links/5ada3ea6a6fdcc2935884957/Natural-history-of-Anolis-cybotes-Sauria-Polychridae-from-an-altered-habitat-in-Barahona-Dominican-Republic.pdf),NA,NA,NA,0.00001928,19.28 m2 (https://www.researchgate.net/profile/Robert_Powell6/publication/289169020_Natural_history_of_Anolis_cybotes_Sauria_Polychridae_from_an_altered_habitat_in_Barahona_Dominican_Republic/links/5ada3ea6a6fdcc2935884957/Natural-history-of-Anolis-cybotes-Sauria-Polychridae-from-an-altered-habitat-in-Barahona-Dominican-Republic.pdf),Nikki,unk,,
no,Anolis,krugi,Chordata,Lepidosauria,Squamata,Iguanidae,males_adults,unk,39.4mm SVL (https://doi.org/10.2307/1935223),unk,,,10-100,GENETIC: seems gene flow can occur over 50km but not over 100km based on clades (https://doi.org/10.1111/j.1365-294X.2010.04616.x),,,unk,,3.6,SVL (https://www.fs.usda.gov/detail/elyunque/learning/nature-science/?cid=fsbdev3_042903) - could not find better source,4.5,SVL (https://www.fs.usda.gov/detail/elyunque/learning/nature-science/?cid=fsbdev3_042903) - could not find better source,,none,no dormancy reported,non-migratory,taxa,NA,NA,NA,unk,,Nikki,unk,,
no,Anolis,pulchellus,Chordata,Lepidosauria,Squamata,Iguanidae,males_adults,unk,,unk,,,0-1,"MOVEMENT: ""little vagility"" with very high recapture within 20m2 (DOI: 10.2307/1563250)",,,unk,,4.571,SVL (doi:10.1016/j.zool.2006.06.001),4.571,SVL (doi:10.1016/j.zool.2006.06.001),Y,none,no dormancy reported,non-migratory,taxa,NA,NA,NA,0.00005,less than 20m2 (DOI: 10.2307/15632500,Nikki,unk,,
no,Anolis,semilineatus,Chordata,Lepidosauria,Squamata,Iguanidae,adults,unk,,unk,,,unk,,,,4,SVL 40 mm - maximum of a museum set of samples+ pg 131 (Cochran+ D. M. (1941). The herpetology of Hispaniola. Bulletin of the United States National Museum.),,,,,,none,no dormancy reported,non-migratory,taxa,NA,NA,NA,unk,,Nikki,unk,,
no,Cophosaurus,texanus,Chordata,Lepidosauria,Squamata,Iguanidae,adult,50,reproduce when they reach 50mm (Ballinger+ R.+ E. Tyler+ D. Tinkle. 1972. Reproductive ecology of a west Texas population of the greater earless lizard+ Cophosaurus texanus. The American Midland Naturalist+ 88/2: 419-428.) and growth conversion from (Sugg+ D.+ L. Fitzgerald+ H. Snell. 1995. Growth rate+ timing of reproduction+ and size dimorphism in the southwestern earless lizard (Cophosaurus texanus scitulus). The Southwestern Naturalist+ 40/2: 193-202.),30,58-74mm when they produce sperm (Schrank+ G.+ R. Ballinger. 1973. Male reproductive cycles in two species of lizards (Cophosaurus texanus and Cnemidophorus gularis). Herpetologica+ 29/3: 289-293.)+ conversion from (Sugg+ D.+ L. Fitzgerald+ H. Snell. 1995. Growth rate+ timing of reproduction+ and size dimorphism in the southwestern earless lizard (Cophosaurus texanus scitulus). The Southwestern Naturalist+ 40/2: 193-202.) ,,0-1,MOVEMENT: usually remained near the same vicinity as original capture site+ transect size not specified but one contained 9 traps 20m apart so probably around 100x100m (https://science.utep.edu/bridges/images/PDFs/Carbajal+%20Mickey.pdf),,,8.8,SVL male (William G. Degenhardt+ Charles W. Painter+ Andrew H. Price. Amphibians and Reptiles of New Mexico. 2005. p507),6.2,SVL (William G. Degenhardt+ Charles W. Painter+ Andrew H. Price. Amphibians and Reptiles of New Mexico. 2005. p507),6.89,SVL (William G. Degenhardt+ Charles W. Painter+ Andrew H. Price. Amphibians and Reptiles of New Mexico. 2005. p507),,Oct - Mar,hibernation (Sugg+ D.+ L. Fitzgerald+ H. Snell. 1995. Growth rate+ timing of reproduction+ and size dimorphism in the southwestern earless lizard (Cophosaurus texanus scitulus). The Southwestern Naturalist+ 40/2: 193-202.),non-migratory,no mention in life history (DOI: 10.2307/1446538),NA,NA,NA,0.1943-0.263,Table 2 (https://doi.org/10.1016/j.zool.2007.04.001),Nikki,540,maximum (Sugg+ D.+ L. Fitzgerald+ H. Snell. 1995. Growth rate+ timing of reproduction+ and size dimorphism in the southwestern earless lizard (Cophosaurus texanus scitulus). The Southwestern Naturalist+ 40/2: 193-202.),
no,Dipsosaurus,dorsalis,Chordata,Lepidosauria,Squamata,Iguanidae,adult,930,31-33 months (C. O'Neil Krekorian. (1984). Life History of the Desert Iguana+ Dipsosaurus dorsalis. Herpetologica+ 40(4)+ 415-424),930,31-33 months (C. O'Neil Krekorian. (1984). Life History of the Desert Iguana+ Dipsosaurus dorsalis. Herpetologica+ 40(4)+ 415-424),Y,0-1,MOVEMENT: based on capture-recapture+ 92% within 40m of original home range (C. O'Neil Krekorian. (1984). Life History of the Desert Iguana+ Dipsosaurus dorsalis. Herpetologica+ 40(4)+ 415-424),,,13.5,SVL (Hulse+ A. C. (1992). Dipsosaurus+ D. dorsalis. Catalogue of American Amphibians and Reptiles (CAAR)),13,SVL (https://animaldiversity.org/accounts/Dipsosaurus_dorsalis/#893F759A-9E61-4D79-BB6A-FE5D2FE24A61),13,SVL (https://animaldiversity.org/accounts/Dipsosaurus_dorsalis/#893F759A-9E61-4D79-BB6A-FE5D2FE24A61),Y,Oct - Mar,hibernation (Moberly+ W. R. 1963. Hibernation in the desert iguana+ Dipsosaurus dorsalis. Physiol. Zool. 36:152-160.),non-migratory,no mention in life history (https://www.jstor.org/stable/3892094),NA,NA,NA,0.00126,92% within 40m of original home range+ used as linear home range (diameter) (C. O'Neil Krekorian. (1984). Life History of the Desert Iguana+ Dipsosaurus dorsalis. Herpetologica+ 40(4)+ 415-424),Nikki,5329,14.6 years in captivity (AnAge),
