no_acclimation,genus,species,phylum,class,order,family,life_stage,age_maturity_days_female,age_maturity_days_female_reference,age_maturity_days_male,age_maturity_days_male_reference,age_maturity-days_unknown_sex,dispersal_distance_category,logic_source_for_dispersal_distance,dispersal_distance2_category,logic_source_for_dispersal_distance2,maximum_body_size_svl_hbl_cm,source_for_maximum_body_size,average_body_size_female,average_body_size_female_reference,average_body_size_male,average_body_size_male_reference,average_body_size_unknown_sex,season_inactive,logic_source_for_season_inactive,migratory,source_logic_for_migration_info,season_when_away_10km+ (migratory only),season_when_away_100km+ (migratory only),logic_source_season_when_away,Home range size_Km2,logic-source_for_Home range size,data_gatherer,lifespan_days,lifespan_days_reference,Notes
,Notropis,rubellus,Chordata,Actinopterygii,Cypriniformes,Cyprinidae,sub-adults,365,1 year (Wichert+ G. A.+ & Rapport+ D. J. (1998). Fish community structure as a measure of degradation and rehabilitation of riparian systems in an agricultural drainage basin. Environmental Management+ 22(3)+ 425-443.),365,1 year (Wichert+ G. A.+ & Rapport+ D. J. (1998). Fish community structure as a measure of degradation and rehabilitation of riparian systems in an agricultural drainage basin. Environmental Management+ 22(3)+ 425-443.),Y,unk,eggs sink and stick to objects (IUCN Red List),,,9,TL male/unsexed -fishbase,6.7,TL male/unsexed -fishbase,6.7,TL male/unsexed -fishbase,Y,none,no dormancy reported,non-migratory,IUCN Red List,NA,NA,NA,unk,,Nikki,1095,3 years max (fishbase),
,Notropis,stramineus,Chordata,Actinopterygii,Cypriniformes,Cyprinidae,NA,730,2-3 years (Huenemann+ T. W.+ Steffensen+ K. D.+ Mestl+ G.+ Shuman+ D. A.+ & Stukel+ S. (2015). The Status of Fishes in the Missouri River+ Nebraska: Emerald Shiner (Notropis atherinoides)+ Red Shiner (Cyprinella lutrensis)+ River Shiner (N. blennius)+ Sand Shiner N. stramineus)+ Spotfin Shiner (C. spiloptera.),730,2-3 years (Huenemann+ T. W.+ Steffensen+ K. D.+ Mestl+ G.+ Shuman+ D. A.+ & Stukel+ S. (2015). The Status of Fishes in the Missouri River+ Nebraska: Emerald Shiner (Notropis atherinoides)+ Red Shiner (Cyprinella lutrensis)+ River Shiner (N. blennius)+ Sand Shiner N. stramineus)+ Spotfin Shiner (C. spiloptera.),Y,unk,eggs sink and stick to objects (IUCN Red List),,,8.2,TL male/unsexed -fishbase,4.4,TL male/unsexed -fishbase,4.4,TL male/unsexed -fishbase,Y,none,no dormancy reported,non-migratory,IUCN Red List,NA,NA,NA,unk,,Nikki,1095,3 years max (Huenemann+ T. W.+ Steffensen+ K. D.+ Mestl+ G.+ Shuman+ D. A.+ & Stukel+ S. (2015). The Status of Fishes in the Missouri River+ Nebraska: Emerald Shiner (Notropis atherinoides)+ Red Shiner (Cyprinella lutrensis)+ River Shiner (N. blennius)+ Sand Shiner N. stramineus)+ Spotfin Shiner (C. spiloptera.),
,Pimephales,notatus,Chordata,Actinopterygii,Cypriniformes,Cyprinidae,sub-adults,365,age 1 (NatureServe Explorer),730,age 2 (NatureServe Explorer),,10-100,"OTHER: authors suggest single population across sites of 20km separation based on dispersal of cyprinids in general (https://doi.org/10.1674/0003-0031-169.1.137)
LARVAE: nest spawn in holes (fishbase)",,,11,TL male/unsexed -fishbase,6.5,TL male/unsexed -fishbase,6.5,TL male/unsexed -fishbase,Y,none,no dormancy reported,non-migratory,IUCN Red List,NA,NA,NA,unk,,Nikki,1825,typical 2 years (https://animaldiversity.org/accounts/Pimephales_notatus/) 5 years max (fishbase),
,Rhinichthys,osculus,Chordata,Actinopterygii,Cypriniformes,Cyprinidae,NA,730,end of second year (NatureServe Explorer+ Peden+ A. E.+ & Hughes+ G. W. (1981). Life history notes relevant to the Canadian status of the speckled dace (Rhinichthys osculus). Syesis+ 14(1981)+ 21-31.),unk,,,1-10,LARVAE: larval drift of 8.6km (https://doi.org/10.1577/1548-8659(1998)127<0772:DOLFIA>2.0.CO;2),,,11,TL male/unsexed -fishbase,6.3,TL male/unsexed -fishbase,6.3,TL male/unsexed -fishbase,Y,none,no dormancy reported,non-migratory,IUCN Red List,NA,NA,NA,unk,,Nikki,2190,3-6 years max (NatureServe Explorer),
,Siphateles,bicolor,Chordata,Actinopterygii,Cypriniformes,Cyprinidae,juveniles,730,2-3 years (NatureServe Explorer),730,2 years (NatureServe Explorer),,unk,,,,45,TL male/unsexed -fishbase,,,,,,none,no dormancy reported,non-migratory,IUCN Red List,NA,NA,NA,unk,,Nikki,13140,35 years max (Finger+ A. J.+ & May+ B. (2015). Conservation genetics of a desert fish species: the Lahontan tui chub (Siphateles bicolor ssp.). Conservation Genetics+ 16(3)+ 743-758.),
,Squalius,cephalus,Chordata,Actinopterygii,NA,Cyprinidae,juveniles,1460,4-6 years (IUCN Red List),730,2-4 years (IUCN Red List),,1-10,"MOVEMENT: majority found less than 1km from home tributary in post-spawning season (https://doi.org/10.25225/fozo.v62.i1.a1.2013)
MIGRATION: spawning migrations of 10+km (Fredrich+ F.+ Ohmann+ S.+ Curio+ B.+ & Kirschbaum+ F. (2003). Spawning migrations of the chub in the River Spree+ Germany. Journal of Fish Biology+ 63(3)+ 710-723.)",,,60,TL male/unsexed -fishbase,30,TL male/unsexed -fishbase,30,TL male/unsexed -fishbase,Y,none,no dormancy reported,migratory,IUCN Red List,April/May/June,NA,"DISTANCE: 15km away (Fredrich+ F.+ Ohmann+ S.+ Curio+ B.+ & Kirschbaum+ F. (2003). Spawning migrations of the chub in the River Spree+ Germany. Journal of Fish Biology+ 63(3)+ 710-723.)
TIMING: two spawn periods a year in May and June in one population (Fredrich+ F.+ Ohmann+ S.+ Curio+ B.+ & Kirschbaum+ F. (2003). Spawning migrations of the chub in the River Spree+ Germany. Journal of Fish Biology+ 63(3)+ 710-723.)
April/May in another population (https://doi.org/10.1007/s11356-014-2666-5)",0.0000126-0.79,close range habitat 2-270m+ widest 500m (Fredrich+ F.+ Ohmann+ S.+ Curio+ B.+ & Kirschbaum+ F. (2003). Spawning migrations of the chub in the River Spree+ Germany. Journal of Fish Biology+ 63(3)+ 710-723.),Nikki,5475,up to 15 years (IUCN Red List),
,Cyprinodon,bovinus,Chordata,Actinopterygii,Cyprinodontiformes,Cyprinodontidae,NA,unk,unk but a study based on other related species (Hanna+ A. H.+ Carson+ E. W.+ Garrett+ G. P.+ & Gold+ J. R. (2015). Conservation genetics of six species of genus Dionda (Cyprinidae) in the southwestern United States. Monographs of the Western North American Naturalist+ 1-25.),unk,unk but a study based on other related species (Hanna+ A. H.+ Carson+ E. W.+ Garrett+ G. P.+ & Gold+ J. R. (2015). Conservation genetics of six species of genus Dionda (Cyprinidae) in the southwestern United States. Monographs of the Western North American Naturalist+ 1-25.),Y,unk,,,,5.6,TL male/unsexed -fishbase,3.8,TL male/unsexed -fishbase,3.8,TL male/unsexed -fishbase,Y,kunk,may burrow in mud like related species+ but not confirmed well (Kennedy+ S. E. (1977). Life history of the Leon Springs pupfish+ Cyprinodon bovinus. Copeia+ 93-103.),non-migratory,IUCN Red List,NA,NA,NA,unk,,Nikki,690,20-23 months max (NatureServe Explorer),
,Cyprinodon,dearborni,Chordata,Actinopterygii,Cyprinodontiformes,Cyprinodontidae,NA,90,3 months (https://www.repository.naturalis.nl/document/549947),90,3 months (https://www.repository.naturalis.nl/document/549947),Y,unk,,,,4,TL male/unsexed -fishbase (Debrot+ A. O. (2003). A review of the freshwater fishes of Curaçao+ with comments on those of Aruba and Bonaire. Caribbean Journal of Science+ 39(1)+ 100-108.),,,,,,none,tropical fish (fishbase),non-migratory,spawn all year in normal territory (https://www.repository.naturalis.nl/document/549947),NA,NA,NA,unk,,Nikki,unk,,
,Cyprinodon,nevadensis,Chordata,Actinopterygii,Cyprinodontiformes,Cyprinodontidae,NA,28,4-6 weeks (NatureServe Explorer),28,4-6 weeks (NatureServe Explorer),Y,unk,eggs adhere to substrate (NatureServe Explorer),,,7.8,TL male/unsexed -fishbase (Debrot+ A. O. (2003). A review of the freshwater fishes of Curaçao+ with comments on those of Aruba and Bonaire. Caribbean Journal of Science+ 39(1)+ 100-108.),4.5,TL male/unsexed -fishbase (Debrot+ A. O. (2003). A review of the freshwater fishes of Curaçao+ with comments on those of Aruba and Bonaire. Caribbean Journal of Science+ 39(1)+ 100-108.),4.5,TL male/unsexed -fishbase (Debrot+ A. O. (2003). A review of the freshwater fishes of Curaçao+ with comments on those of Aruba and Bonaire. Caribbean Journal of Science+ 39(1)+ 100-108.),Y,none,no dormancy reported,non-migratory,IUCN Red List,NA,NA,NA,unk,,Nikki,365,12 months expected lifespan (Lee+ R. M.+ & Gerking+ S. D. (1980). Survival and reproductive performance of the desert pupfish+ Cyprinodon n. nevadensis (Eigenmann and Eigenmann)+ in acid waters. Journal of Fish Biology+ 17(5)+ 507-515.),
,Gobiomorphus,basalis,Chordata,Actinopterygii,Perciformes,Eleotridae,juveniles adults,365,1 year (IUCN Red List),365,1 year (IUCN Red List),Y,unk,,,,9,TL male/unsexed -fishbase,,,,,,none,no dormancy reported,non-migratory,IUCN Red List,NA,NA,NA,unk,,Nikki,2920,8 years+ not specified whether avg/max (IUCN Red List),
,Gobiomorphus,cotidianus,Chordata,Actinopterygii,Perciformes,Eleotridae,juveniles adults,365,1 year (IUCN Red List),365,1 year (IUCN Red List),Y,1-10,"GENETIC: genetically distinct populations 9km away (10.1021/es061922q)
MOVEMENT: known to exhibit high site fidelity as adults (Landman+ M. J.+ Bleackley+ N. A.+ Ling+ N.+ & van den Heuvel+ M. R. (2010). Physiological health of common bully (Gobiomorphus cotidianus) in the Tarawera and Rangitaiki Rivers of New Zealand: evidence of diminished ecological effects of pulp and paper effluents in wild fish populations. Water Quality Research Journal+ 45(2)+ 223-233.) 
MIGRATION: diadromous so 100+",,,15,TL male/unsexed -fishbase,,,,,,none,no dormancy reported,migratory,IUCN Red List,winter,NA,"DISTANCE: 35km from info on (https://doi.org/10.1186/1471-2148-8-49)
TIMING: diadromous+ migratory river ecotypes spawn in winter+ lake ecotypes lost migration (https://doi.org/10.1186/1471-2148-8-49)
POPULATION SPECIFIC: some non-migratory ecotypes (lake ecotypes lost migration (https://doi.org/10.1186/1471-2148-8-49)",unk,,Nikki,1825,4-5 years+ not specified whether avg/max (IUCN Red List),
,Fundulus,diaphanus,Chordata,Actinopterygii,Cyprinodontiformes,Fundulidae,Limnodynastes tasmaniensis,365,1-2 years (Phillips+ E. C.+ Ewert+ Y.+ & Speares+ P. A. (2007). Fecundity+ age and growth+ and diet of Fundulus diaphanus (banded killifish) in Presque Isle Bay+ Lake Erie. Northeastern Naturalist+ 14(2)+ 269-279.),unk,,,unk,"MOVEMENT: study of around 800 fish found no site fidelity (https://doi.org/10.1034/j.1600-0706.2000.890314.x)
LARVAE: adhesive eggs (IUCN Red List)",,,13,TL male/unsexed -fishbase,6.3,TL male/unsexed -fishbase,6.3,TL male/unsexed -fishbase,Y,none,no dormancy reported,non-migratory,IUCN Red List,NA,NA,NA,unk,,Nikki,1580,4 years max (Phillips+ E. C.+ Ewert+ Y.+ & Speares+ P. A. (2007). Fecundity+ age and growth+ and diet of Fundulus diaphanus (banded killifish) in Presque Isle Bay+ Lake Erie. Northeastern Naturalist+ 14(2)+ 269-279.),
,Fundulus,heteroclitus,Chordata,Actinopterygii,Cyprinodontiformes,Fundulidae,NA,365,1-2 years (NatureServe Explorer),365,1-2 years (NatureServe Explorer),Y,1-10,MOVEMENT: individuals travelled 2 km upstream+ have high site fidelity and small migration area (https://link.springer.com/content/pdf/10.2307%2F1350898.pdf + https://doi.org/10.1016/j.cbpc.2016.05.005),,,15,TL male/unsexed -fishbase,8.9,TL male/unsexed -fishbase,8.9,TL male/unsexed -fishbase,Y,kunk,"may migrate/burrow but literature disagrees on it according to (Skinner+ M. A.+ Courtenay+ S. C.+ Parker+ W. R.+ & Curry+ R. A. (2005). Site fidelity of mummichogs (Fundulus heteroclitus) in an Atlantic Canadian estuary. Water Quality Research Journal+ 40(3)+ 288-298.) IUCN Red List writes ""may burrow""",non-migratory,IUCN Red List,NA,NA,NA,0.00407-0.13,consistently recaptured within 36- 200m of release depending on population (Skinner+ M. A.+ Courtenay+ S. C.+ Parker+ W. R.+ & Curry+ R. A. (2005). Site fidelity of mummichogs (Fundulus heteroclitus) in an Atlantic Canadian estuary. Water Quality Research Journal+ 40(3)+ 288-298.)+ home range of less than 30m from (https://scholarworks.wm.edu/cgi/viewcontent.cgi?article=2686&context=etd)+ home range of 36m from (https://doi.org/10.2307/1935311),Nikki,1580,4 years max+ (https://doi.org/10.1016/0022-0981(78)90125-9) + fishbase,
,Fundulus,notatus,Chordata,Actinopterygii,Cyprinodontiformes,Fundulidae,NA,365,1 year (NatureServe Explorer),365,1 year (NatureServe Explorer),Y,0-1,MOVEMENT: 23m in a day (Alldredge+ P.+ Gutierrez+ M.+ Duvernell+ D.+ Schaefer+ J.+ Brunkow+ P.+ & Matamoros+ W. (2011). Variability in movement dynamics of topminnow (Fundulus notatus and F. olivaceus) populations. Ecology of Freshwater Fish+ 20(4)+ 513-521.),,,8,TL male/unsexed -fishbase,5.8,TL male/unsexed -fishbase,5.8,TL male/unsexed -fishbase,Y,none,winters in deeper water (NatureServe Explorer),non-migratory,IUCN Red List,NA,NA,NA,unk,home range shift model of fish movement (Alldredge+ P.+ Gutierrez+ M.+ Duvernell+ D.+ Schaefer+ J.+ Brunkow+ P.+ & Matamoros+ W. (2011). Variability in movement dynamics of topminnow (Fundulus notatus and F. olivaceus) populations. Ecology of Freshwater Fish+ 20(4)+ 513-521.),Nikki,1095,2-3 years oldest in populations (https://sararegistry.gc.ca/virtual_sara/files/cosewic/sr_fondule_raye_blackstripe_topminnow_1012_e.pdf),
,Gobiesox,strumosus,Chordata,Actinopterygii,Perciformes,Gobiesocidae,adults,150,40 mm+ born june and reached 40 mm by about october (DOI: 10.2307/1351173),unk,,Y,unk,LARVAE: no pelagic larvae (https://www.jstor.org/stable/24316587) spawn in oyster shells (DOI: 10.2307/1351173),,,8,TL male/unsexed -fishbase,,,,,,none,tropical fish (fishbase),non-migratory,live and spawn in estuarine environments (Saksena+ V. P.+ & Joseph+ E. B. (1972). Dissolved oxygen requirements of newly-hatched larvae of the striped blenny (Chasmodes bosquianus)+ the naked goby (Gobiosoma bosci)+ and the skilletfish (Gobiesox strumosus). Chesapeake Science+ 13(1)+ 23-28.),NA,NA,NA,unk,,Nikki,unk,,
,Bathygobius,fuscus,Chordata,Actinopterygii,Perciformes,Gobiidae,NA,unk,40.4 mm SL min (Kong+ Y. H.+ & Chen+ I. S. (2013). Reproductive biology of intertidal frillfin goby+ Bathygobius fuscus in Keelung+ Taiwan. Journal of Marine Science and Technology+ 21+ 213-215.),unk,,,0-1,MOVEMENT: based on daily movements+ fig 3 (Taru+ M.+ Kanda+ T.+ & Sunobe+ T. (2002). Alternative mating tactics of the gobiid fish Bathygobiusfuscus. Journal of ethology+ 20(1)+ 9-12.),,,12,TL male/unsexed -fishbase,,,,,,none,tropical fish (fishbase),non-migratory,non-amphidromous (https://doi.org/10.3989/scimar.2006.70s2165),NA,NA,NA,unk,could calculate from fig 3 (Taru+ M.+ Kanda+ T.+ & Sunobe+ T. (2002). Alternative mating tactics of the gobiid fish Bathygobiusfuscus. Journal of ethology+ 20(1)+ 9-12.),Nikki,1460,3-4 year lifespan (Takegaki+ T.+ Kaneko+ T.+ & Matsumoto+ Y. (2012). Large-and small-size advantages in sneaking behaviour in the dusky frillgoby Bathygobius fuscus. Naturwissenschaften+ 99(4)+ 285-289.),
,Bathygobius,ramosus,Chordata,Actinopterygii,Perciformes,Gobiidae,NA,unk,,unk,,,unk,,,,20,TL male/unsexed -fishbase,12,TL male/unsexed -fishbase,12,TL male/unsexed -fishbase,Y,none,tropical fish (fishbase),unk,NA,NA,NA,NA,unk,,Nikki,unk,,
,Gobiosoma,chiquita,Chordata,Actinopterygii,Perciformes,Gobiidae,NA,unk,20mm standard length minimum (Miles+ P. S. (1975). Agonistic behavior of some gobiid fishes from the Gulf of California.),unk,,,0-1,LARVAE: larvae dispersed within 100m of reef (https://repository.arizona.edu/bitstream/handle/10150/185972/azu_td_9303314_sip1_m.pdf?sequence=1&isAllowed=y),,,6.5,TL male/unsexed -fishbase,,,,,,none,no dormancy reported,non-migratory,spends cold and warm seasons in intertidal (Miles+ P. S. (1975). Agonistic behavior of some gobiid fishes from the Gulf of California.),NA,NA,NA,unk,,Nikki,unk,,
,Haemulon,flavolineatum,Chordata,Actinopterygii,Perciformes,Haemulidae,NA,450,12-15 cm SL at maturity (IUCN Red List)+ 700 days attain length of 12cm (https://digitalarchive.worldfishcenter.org/bitstream/handle/20.500.12348/3560/Pub%20SR76%207.pdf?sequence=1&isAllowed=y),450,12-15 cm SL at maturity (IUCN Red List)+ 700 days attain length of 12cm (https://digitalarchive.worldfishcenter.org/bitstream/handle/20.500.12348/3560/Pub%20SR76%207.pdf?sequence=1&isAllowed=y),Y,10-100,LARVAE: PLD 14 days (IUCN Red List),,,30,TL male/unsexed -fishbase,17,TL male/unsexed -fishbase,17,TL male/unsexed -fishbase,Y,none,no dormancy reported,non-migratory,locally migrate within about 1km (https://doi.org/10.1006/ecss.2001.0907),NA,NA,NA,2.01-8.04,observed at distances of 0.8-1.6km away (https://digitalarchive.worldfishcenter.org/bitstream/handle/20.500.12348/3560/Pub%20SR76%207.pdf?sequence=1&isAllowed=y),Nikki,kunk,not a great source... https://books.google.ca/books?id=Qd-EDwAAQBAJ&pg=PT317&lpg=PT317&dq=Haemulon+flavolineatum+lifespan&source=bl&ots=W26CW-MjQf&sig=ACfU3U1pAEaHvyrSfb2GMIcUR8kuCCsQrg&hl=en&sa=X&ved=2ahUKEwjT7pa8k97mAhXiV98KHXBVAdEQ6AEwCHoECAkQAQ#v=onepage&q=Haemulon%20flavolineatum%20lifespan&f=false,
,Ameiurus,catus,Chordata,Actinopterygii,Siluriformes,Ictaluridae,juveniles,1095,3-4 years (NatureServe Explorer),1095,3-4 years (NatureServe Explorer),Y,1-10,"MOVEMENT: 89% returned to original locations 2-4km away (Smith+ J. M.+ Michel+ C. J.+ Huff+ D. D.+ Hovel+ R.+ Hayes+ S. A.+ & Lindley+ S. T. (2017). Determining predator distribution and movement with sonic telemetry. Testing the Effects of Manipulated Predator Densities and Environmental Variables on Juvenile Salmonid Survival in the lower San Joaquin River+ 147.)
LARVAE: spawn over nests (IUCN Red List)",,,95,TL male/unsexed -fishbase,30.5,TL male/unsexed -fishbase,30.5,TL male/unsexed -fishbase,Y,none,no dormancy reported,non-migratory,IUCN Red List,NA,NA,NA,unk,,Nikki,5110,14 years max (AnAge),
,Ameiurus,nebulosus,Chordata,Actinopterygii,Siluriformes,Ictaluridae,NA,1095,3rd year (NatureServe Explorer),1095,3rd year (NatureServe Explorer),Y,1-10,MOVEMENT: site fidelity within 4.2 km of initial capture location+ even after return from upstream migration (https://doi.org/10.1577/T04-086.1),,,55,TL male/unsexed -fishbase,25,TL male/unsexed -fishbase,25,TL male/unsexed -fishbase,Y,winter,may burrow to escape adverse environmental conditions (fishbase+ NatureServe Explorer),non-migratory,IUCN Red List,NA,NA,NA,0.045-0.197,4.5-19.7ha throughout season (https://doi.org/10.1577/T04-086.1),Nikki,3285,6-8 average (NatureServe Explorer) 9 years max (fishbase),
,Ictalurus,punctatus,Chordata,Actinopterygii,Siluriformes,Ictaluridae,juveniles,730,2-3 years (fishbase),730,2-3 years (fishbase),Y,100+,"MOVEMENT: frequently caught up to 65 miles downstream of release site (https://doi.org/10.1577/1548-8659(1967)96[351:MOMCCI]2.0.CO;2)
MIGRATION: may travel hundreds of miles (NatureServe Explorer)",,,132,TL male/unsexed -fishbase,57,SL male/unsexed -fishbase,57,SL male/unsexed -fishbase,Y,none,no dormancy reported+ not in paper on winter activity (https://doi.org/10.1046/j.1365-2400.1999.00175.x),non-migratory,IUCN Red List,NA,NA,NA,kunk,no clear home range (https://animaldiversity.org/accounts/Ictalurus_punctatus/),Nikki,8760,14 years average (https://animaldiversity.org/accounts/Ictalurus_punctatus/)+ 24 years max (fishbase),
,Kuhlia,sandvicensis,Chordata,Actinopterygii,Perciformes,Kuhliidae,NA,unk,18 cm,unk,,,unk,estimate based on closely related species pld - PLD of 32.2-44.3 in other Kuhlia species (Feutry+ P.+ Valade+ P.+ Ovenden+ J. R.+ Lopez+ P. J.+ & Keith+ P. (2012). Pelagic larval duration of two diadromous species of Kuhliidae (Teleostei: Percoidei) from Indo-Pacific insular systems. Marine and Freshwater Research+ 63(5)+ 397-402.),,,25,TL male/unsexed -fishbase,,,,,,none,tropical fish (fishbase),migratory,spawning migration (http://www.ahamoku.org/wp-content/uploads/2011/12/Poepoe-Kelson-K-Paul-Bartram-and-Alan-M-Friedlander_The-Use-of-Traditional-Hawaian-Knowledge-In-the-Contemporary-Management-of-Marine-Resources-Putting-Fishers-Knowledge-To-Work-Conference2001.pdf),February/March/April,NA,"DISTANCE: inshore to offshore+ asusme less than 100km but more than 10km
TIMING: endemic to Hawaii+ Feb -April from table 1(http://www.ahamoku.org/wp-content/uploads/2011/12/Poepoe-Kelson-K-Paul-Bartram-and-Alan-M-Friedlander_The-Use-of-Traditional-Hawaian-Knowledge-In-the-Contemporary-Management-of-Marine-Resources-Putting-Fishers-Knowledge-To-Work-Conference2001.pdf)",unk,,Nikki,unk,,
,Morone,saxatilis,Chordata,Actinopterygii,Perciformes,Moronidae,juveniles,1460,4-6 years (IUCN Red List),730,2 years (IUCN Red List),,1-10,"LARVAE: larvae disperse more than 5km (Secor+ D. H.+ Houde+ E. D.+ & Monteleone+ D. M. (1995). A mark-release experiment on larval striped bass Morone saxatilis in a Chesapeake Bay tributary. ICES Journal of Marine Science+ 52(1)+ 87-101.) 
MOVEMENT: high degree of site fidelity across seasons and years to max home range size 1+554+067 m2 (https://doi.org/10.1577/T06-250.1)
MIGRATION: migrate distances up to 725 km (https://ir.library.oregonstate.edu/downloads/37720g039)",,,200,TL male/unsexed -fishbase,120,TL male/unsexed -fishbase,120,TL male/unsexed -fishbase,Y,none,no dormancy reported+ not in paper on winter activity (https://doi.org/10.1046/j.1365-2400.1999.00175.x),migratory,IUCN Red List,late winter-early spring,late winter-early spring,"DISTANCE: migrate distances up to 725 km (https://ir.library.oregonstate.edu/downloads/37720g039)
TIMING: anadromous after first 2 years of life+ migrates late winter to early spring (IUCN Red List+ https://animaldiversity.org/accounts/Morone_saxatilis/)",0.025446-,average home range size = 554+435 m2+ range 26+446–1+554+067 m2 (https://doi.org/10.1577/T06-250.1),Nikki,10950,10-12 average (https://animaldiversity.org/accounts/Morone_saxatilis/) 30 years max (fishbase),
,Chelon,subviridis,Chordata,Actinopterygii,NA,Mugilidae,NA,365,1 year (Al‐Daham+ N. K.+ & Wahab+ N. K. (1991). Age+ growth and reproduction of the greenback mullet+ Liza subviridis (Valenciennes)+ in an estuary in Southern Iraq. Journal of Fish Biology+ 38(1)+ 81-88.),365,1 year (Al‐Daham+ N. K.+ & Wahab+ N. K. (1991). Age+ growth and reproduction of the greenback mullet+ Liza subviridis (Valenciennes)+ in an estuary in Southern Iraq. Journal of Fish Biology+ 38(1)+ 81-88.),Y,10-100,LARVAE: PLD 20 days; development of all fins by 20 days (10.3329/bjz.v42i1.23344),,,40,SL male/unsexed -fishbase,25,TL male/unsexed -fishbase,25,TL male/unsexed -fishbase,Y,none,no dormancy reported,non-migratory,classified as non-catadromous (https://doi.org/10.1016/j.ecss.2012.04.023),NA,NA,leaves estuary to spawn at sea after age 2 - distance travelled not found and classified as non-catadromous so likely less than 10km (https://pdfs.semanticscholar.org/85a3/dce469fe7fb135744508d8dd584bfd248b9c.pdf),unk,,Nikki,2190,6 years max (Al‐Daham+ N. K.+ & Wahab+ N. K. (1991). Age+ growth and reproduction of the greenback mullet+ Liza subviridis (Valenciennes)+ in an estuary in Southern Iraq. Journal of Fish Biology+ 38(1)+ 81-88.),alternative taxonomic name used for research (Liza subviridis)
,Gobionotothen,gibberifrons,Chordata,Actinopterygii,Perciformes,Nototheniidae,NA,2190,6-8 years (fishbase),unk,,,100+,LARVAE: PLD 4 months (Matschiner+ M.+ Hanel+ R.+ & Salzburger+ W. (2009). Gene flow by larval dispersal in the Antarctic notothenioid fish Gobionotothen gibberifrons. Molecular ecology+ 18(12)+ 2574-2587.),,,55,TL male/unsexed -fishbase,40,TL male/unsexed -fishbase,40,TL male/unsexed -fishbase,Y,none,no dormancy reported+ demersal during winter (North+ A. W. (2001). Early life history strategies of notothenioids at South Georgia. Journal of Fish Biology+ 58(2)+ 496-505.),non-migratory,inshore/offshore stages+ full adult life in offshore habitat (Marschoff+ E. R.+ Barrera-Oro+ E. R.+ Alescio+ N. S.+ & Ainley+ D. G. (2012). Slow recovery of previously depleted demersal fish at the South Shetland Islands+ 1983–2010. Fisheries Research+ 125+ 206-213.),NA,NA,NA,unk,,Nikki,4380,12 years max found in a study (Marschoff+ E. R.+ Barrera-Oro+ E. R.+ Alescio+ N. S.+ & Ainley+ D. G. (2012). Slow recovery of previously depleted demersal fish at the South Shetland Islands+ 1983–2010. Fisheries Research+ 125+ 206-213.),
,Notothenia,coriiceps,Chordata,Actinopterygii,Perciformes,Nototheniidae,NA,2555,7 years (Calì+ F.+ Riginella+ E.+ La Mesa+ M.+ & Mazzoldi+ C. (2017). Life history traits of Notothenia rossii and N. coriiceps along the southern Scotia Arc. Polar Biology+ 40(7)+ 1409-1423.),2555,7 years (Calì+ F.+ Riginella+ E.+ La Mesa+ M.+ & Mazzoldi+ C. (2017). Life history traits of Notothenia rossii and N. coriiceps along the southern Scotia Arc. Polar Biology+ 40(7)+ 1409-1423.),,100+,LARVAE: PLD of several months+ eggs can drift from Anarctica to South Georgia (http://sfi-cybium.fr/en/node/2065),,,62,TL male/unsexed -fishbase,50,TL male/unsexed -fishbase,50,TL male/unsexed -fishbase,Y,June - Oct,winter dormancy considered as hibernation (Campbell+ H. A.+ Fraser+ K. P.+ Bishop+ C. M.+ Peck+ L. S.+ & Egginton+ S. (2008). Hibernation in an Antarctic fish: on ice for winter. PLoS One+ 3(3)+ e1743.),unk,NA,NA,NA,NA,0.00018,180 m^2 from May-Oct (https://doi.org/10.1017/S095410201000091X),Nikki,6570,18 years max (Calì+ F.+ Riginella+ E.+ La Mesa+ M.+ & Mazzoldi+ C. (2017). Life history traits of Notothenia rossii and N. coriiceps along the southern Scotia Arc. Polar Biology+ 40(7)+ 1409-1423.),
