assessmentId,internalTaxonId,scientificName,redlistCategory,redlistCriteria,yearPublished,assessmentDate,criteriaVersion,language,rationale,habitat,threats,population,populationTrend,range,useTrade,systems,conservationActions,realm,yearLastSeen,possiblyExtinct,possiblyExtinctInTheWild,scopes
1110472,166083,Carassius auratus,Least Concern,NA,2013,2010-08-04 00:00:00 UTC,3.1,English,The species is assessed as Least Concern as it has a large distribution area and there are no known widespread threats to this species.,"<span class=""slabel"">This species inhabits rivers, lakes, reservoirs, ponds and ditches (Man and Hodgkiss 1981, Etnier and Starnes 1993) with stagnant or slow-flowing water (Billard 1997).<span class=""slabel""> <span class=""sheader5"">It occurs in eutrophic fresh and brackish waters, well vegetated ponds and canals (Kottelat and Freyhof 2007). <span class=""slabel""><span class=""slabel""><span class=""slabel""><span class=""slabel""><span class=""slabel""><span class=""slabel""><span class=""slabel""><span class=""slabel""><span class=""slabel""><span class=""slabel"">The maximum recorded salinity is 17 ppt, but it is unable to withstand prolonged exposure above 15 ppt (<span class=""slabel""><span class=""slabel""><span class=""slabel""><span class=""slabel""><span class=""slabel""><span class=""slabel""><span class=""slabel""><span class=""slabel""><span class=""slabel""><span class=""slabel"">Schwartz 1964<span class=""slabel""><span class=""slabel""><span class=""slabel""><span class=""slabel""><span class=""slabel""><span class=""slabel""><span class=""slabel""><span class=""slabel""><span class=""slabel""><span class=""slabel"">).<span class=""sheader5""><span class=""slabel""><span class=""slabel""><span class=""slabel""><span class=""slabel"">&#160;It feeds on a wide range of food including plants, small crustaceans, insects, and detritus <span class=""sheader5"">(Kottelat and Freyhof 2007)<span class=""slabel""><span class=""slabel""><span class=""slabel""><span class=""slabel""><span class=""slabel""><span class=""slabel"">.<span class=""slabel""><span class=""slabel""><span class=""slabel""><span class=""slabel""><span class=""slabel""><span class=""slabel""><span class=""slabel""><span class=""slabel""><span class=""slabel""><span class=""slabel""> <span class=""slabel""><span class=""slabel""><span class=""slabel""><span class=""slabel""><span class=""slabel""><span class=""slabel""><span class=""slabel""><span class=""slabel"">The species usually lives up to about 20 years under artificial conditions.<br/><span class=""slabel""><span class=""slabel""><span class=""slabel""><span class=""slabel""><span class=""slabel""><span class=""slabel""><span class=""slabel""><span class=""slabel""><span class=""slabel""><span class=""slabel""><br/><span class=""slabel""><span class=""slabel""><span class=""slabel""><span class=""slabel""><span class=""slabel""><span class=""slabel""><span class=""slabel""><span class=""slabel""><span class=""slabel""><span class=""slabel"">It is oviparous, with pelagic larvae. <span class=""slabel""><span class=""slabel""><span class=""slabel""><span class=""slabel""><span class=""slabel""><span class=""slabel""><span class=""slabel""><span class=""slabel""><span class=""slabel""><span class=""slabel"">It spawns when water temperatures reach 15-20 °C<span class=""slabel""><span class=""slabel""><span class=""slabel""><span class=""slabel""><span class=""slabel""><span class=""slabel""><span class=""slabel""><span class=""slabel""><span class=""slabel""><span class=""slabel"">. <span class=""slabel""><span class=""slabel""><span class=""slabel""><span class=""slabel""><span class=""slabel""><span class=""slabel""><span class=""slabel""><span class=""slabel""><span class=""slabel""><span class=""slabel"">Juveniles require high temperature to grow. Individual females spawn with a few males in dense vegetation. The eggs are sticky, attached to water plants or other submerged objectives.<br/><span><span class=""slabel""><span></span></span></span></span></span></span></span></span></span></span></span></span></span></span></span></span></span></span></span></span></span></span></span></span></span></span></span></span></span></span></span></span></span></span></span></span></span></span></span></span></span></span></span></span></span></span></span></span></span></span></span></span></span></span></span></span></span></span>",No threats to this species are known.,"<span class=""short_text"" id=""result_box"">There is no information available on the species' population within its natural distribution range.",Unknown,"The species is reported to be native to East Asia: from the Amur River to the Pearl River basin including the Korean Peninsula and Taiwan (Freyhof and Kottelat 2007). It was domesticated in China more than 1,000 years ago, introduced to Japan in the 16<sup>th </sup>century and from Japan imported to Europe: Portugal 1611, England 1691 and France 1755. From then it was introduced throughout Europe and most of the world. <br/><span><br/>It was introduced  throughout the world as the Asian form of the goldfish. Several countries  report adverse ecological impact after introduction.<br/><br/>This is possibly the species (or <span style=""font-style: italic;"">Carassioides acuminatus</span>) <span>""<span style=""font-style: italic;"">Pa Fek</span>"" that has been introduced into the Nam Theun reservoir in Lao PDR where it has established very well.</span>","<span class=""slabel""><span class=""slabel"">The species is valued as ornamental fish for ponds and aquaria; it is edible but rarely eaten (Frimodt 1995). <span class=""slabel""><span class=""slabel""><span class=""sheader5""><span class=""slabel""><span class=""slabel""><span class=""slabel""><span class=""slabel""><span class=""slabel""><span class=""slabel""><span class=""slabel""><span class=""slabel""><span class=""slabel""><span class=""slabel""><span class=""slabel""><span class=""slabel""><span class=""slabel""><span class=""slabel""><span class=""slabel""><span class=""slabel""><span class=""slabel""><span class=""slabel""><span class=""slabel""><span class=""slabel""><span class=""slabel""><span class=""slabel""><span class=""sheader5""><span class=""slabel""><span class=""slabel""><span class=""slabel""><span class=""sheader5""><span class=""slabel""><span class=""slabel""><span class=""slabel""><span class=""slabel""><span class=""slabel""><span class=""slabel""><span class=""slabel""><span class=""slabel""><span class=""slabel""><span class=""slabel""><span class=""slabel""><span class=""slabel""><span class=""slabel""><span class=""slabel""><span class=""slabel""><span class=""slabel""><span class=""slabel""><span class=""slabel""><span class=""slabel""><span class=""slabel""><span class=""slabel""><span class=""slabel""><span class=""slabel""><span class=""slabel""><span class=""slabel""><span class=""slabel""><span class=""slabel""><span class=""slabel""><span class=""slabel""><span class=""slabel""><span class=""slabel""><span class=""slabel""><span class=""slabel""><span class=""slabel""><span class=""slabel""><span class=""slabel""><span class=""slabel""><span class=""slabel""><span class=""slabel""><span class=""slabel""><span class=""slabel""><span class=""slabel""><span class=""slabel""><span class=""slabel""><span class=""slabel""><span class=""slabel""><span class=""slabel""><span class=""slabel""><span class=""slabel""><span class=""slabel""><span class=""slabel""><span class=""slabel""><span class=""slabel""><span class=""slabel""><span class=""slabel""><span class=""slabel""><span class=""slabel""><span class=""slabel"">It is also used as an experimental species (Robinson <span style=""font-style: italic;"">et al. </span>1991).<span class=""slabel""><span class=""slabel""><br/><span class=""short_text"" id=""result_box""></span></span></span></span></span></span></span></span></span></span></span></span></span></span></span></span></span></span></span></span></span></span></span></span></span></span></span></span></span></span></span></span></span></span></span></span></span></span></span></span></span></span></span></span></span></span>",Freshwater (=Inland waters),None required.,Indomalayan|Palearctic,NA,FALSE,FALSE,Global
1116524,166172,Hypophthalmichthys nobilis,Data Deficient,NA,2012,2010-09-02 00:00:00 UTC,3.1,English,"<span style=""font-style: italic;""></span>The species is only native to central and southern China where it has  been declining due to dams, overfishing and loss of habitat. The species  may be threatened and is therefore assessed as Data Deficient due to the lack of knowledge regarding species population size and current population trends&#160; and threats in its natural distribrution range.","In its natural distribution range, inhabits rivers with marked water-level fluctuations, overwinters in middle and lower stretches. Lives up to 20 years. Spawns for the first time at 5-6 years, 550-700 mm SL and 5-10 kg, earlier and smaller in subtropical areas. Migrates long distances upriver at the beginning of a rapid flood and water-level increases (in April-July depending on locality). Spawns during floods. Stops spawning if condition change and starts again with increase of water level. Spawns in upper water layer or even at water surfaces. Females spawn up to 1.1 million eggs in 1-3 portions depending on duration of high-water period. Eggs are yellowish, transparent, and hatch after about 2 days at temperatures around 25°C while drifting downstream in the deep open-water layer. If the river flow is blocked or if available river stretches are too short, eggs cannot drift long enough and fail to develop. After spawning, adults leave the river and migrate back to forage habitats. Larvae drift downstream and settle in floodplain lakes, shallow shores and backwaters with little or no current. In autumn-winter, when temperatures falls to 10°C, juveniles and adults form separate large schools and move downstream to deeper places in the main course of river to overwinter. Feed mostly on zooplankton, also algae. Often crossed with <span style=""font-style: italic;"">H. molitrix</span> (source: Kottelat and Freyhof 2007).","Major threats to <span style=""font-style: italic;"">Hypophthalmichthys nobilis </span>in its native distribution range are overfishing and river modifications (e.g. dams, dykes and floodgate construction and reclamation of floodplains into agriculture land) (Duan<span style=""font-style: italic;""> et. al </span>2009).","In the second half of the 20th century, a marked decline in the abundance of this species was observed in its natural distribution range.",Decreasing,"<span><span style=""font-style: italic;"">&#160;Hypophthalmichthys nobilis</span> is reported to be native to central and south China (Kottelat and Freyhof 2007).<span> Introduced to numerous countries and has achieved a near  global distribution<span>. Established reproductive populations in Europe, North America and Central Asia.&#160;<span> <span><br/></span></span>","<p><span style=""font-style: italic;"">Hypophthalmichthys nobilis </span>is a commercially important fish species in China with high abundance in the catch (Wu <span style=""font-style: italic;"">et al.</span> 2000). It is also used in aquaculture. Marketed fresh and frozen.<br/></p>",Freshwater (=Inland waters),It is not known if there are any conservation measures in place. More research and monitoring is recommended.,Indomalayan,NA,FALSE,FALSE,Global
1139469,166627,Lates calcarifer,Least Concern,NA,2019,2019-02-15 00:00:00 UTC,3.1,English,"<p>A widespread species with no known major widespread threats, it is assessed as Least Concern. &#160;&#160; </p>","This species inhabits coastal waters, estuaries and lagoons, including brackish waters.<br/><br/>It is a coastal and estuarine species that is semi-catadromous, with some individuals either remaining in marine or estuarine waters throughout life, while others penetrate long distances into freshwater nurseries.&#160;<br/><strong><br/></strong>Barramundi are opportunistic predators; crustaceans and fish predominate in the diet of adults (Larson 1999). Juveniles also consume insects (Allen<em> et al.</em> 1999). It is mostly found over soft bottom, hard bottom and rocky substrate (Allen <em>et al. </em>2002); they are also reported to frequent coral reefs (Nguyen and Nguyen 2006). In fresh water habitats, Barramundi prefer&#160;cover on undercut banks, submerged logs and overhanging vegetation&#160;(Allen<em> et al. </em>2002).<br/><br/><em>Lates calcarifer</em> is known to be a protandrous hermaphrodite in Australia (Moore 1979),&#160;but sex change in Asian populations of this species is less well defined and primary females are common. Females are generally absent in the smaller length classes, but dominate larger length classes. Most Barramundi mature first as males and function as males for one or more spawning seasons before undergoing sex inversion. A few females will develop directly from immature fish (Davis 1987). Similarly, some males may never undergo sex inversion (Davis 1987). Length at first maturity for males in Australia is between 29 and 60 cm and an unsexed individual in the Indo-Pacific measured 90 cm.<br/><br/>Spawning seasonality varies within the range of this species.&#160;Barramundi are broadcast spawners that aggregate to spawn (Kailola<em>&#160;et al.</em>&#160;1993).&#160;Barramundi in northern Australia spawn between September and March, with latitudinal variation in spawning season, presumably in response to varying water temperatures (Allen <em>et al</em>. 2002). In the Philippines, Barramundi spawn from late June to late October, while in Thailand spawning is associated with the monsoon season, with two peaks during the northeast monsoon (August – October) and the southwest monsoon (February – June) (Buschmann<em> et al.</em> 1996). Spawning occurs near river mouths, in the lower reaches of estuaries, or around coastal headlands (MacKinnon <em>et al</em>. 1986), and sometimes in the tidal flats near river mouths (Kailola<em> et al.</em> 1993). Barramundi spawn after the full and new moons during the spawning season, and spawning activity is usually associated with incoming tides that apparently assist transport of eggs and larvaer into the estuary (Bushcmann <em>et al</em>. 1996).&#160;<br/><br/>While adults and juveniles are capable of living in fresh water, brackish waters are required for embryonic development (Shaklee and Salini 1985).&#160;Barramundi are highly fecund; a single female (120 cm TL) may produce 30–40 million eggs, or 2.3 million eggs per kg of body weight (Davis 1984). Under hatchery conditions, larvae grow to juveniles in 26 days (MacKinnon 1987).&#160;The postlarvae (and possibly larvae) move from spawning areas to brackish water seasonal habitat (Russell and Garrett 1985). Larval Barramundi occupy these habitats as well as main channels of streams (Kailola<em> et al. </em>1993). Juveniles live in freshwater lagoons, swamps and creeks (Russell and Garett 1985). As these temporary habitats dry up, the juveniles move into the main stream and many migrate upstream to permanent freshwater habitats (Kailola <em>et al.</em> 1993).&#160;Juvenile Barramundi remain in freshwater habitats until they are three–four years of age (60–70 cm TL) when they reach sexual maturity as males, and then move downstream during the breeding season to participate in spawning. Because Barramundi are euryhaline, they can be cultured in a range of salinities, from fresh to seawater. When they are six–eight years old (85–100 cm TL), Australian Barramundi change sex to female and remain female for the rest of their lives (Kailola <em>et al</em>. 1993).<br/><br/><em>Lates calcarifer</em> grows very quickly, achieving 1,500 to 3,000 g in one year (Hora and Pillay 1962). Although some Barramundi have been recorded as undertaking extensive movements between river systems, most of them remain in their original river system and move only short distances. This limited exchange of individuals between river systems is one factor that has contributed to the development of genetically distinct groups of Barramundi in northern Australia, where there are six recognised genetic strains in Queensland, and a further ten in the Northern Territory and Western Australia (FAO&#160;Cultured Aquatic Species Information Programme).","<p>Loss of habitat through damming, mangrove destruction and overfishing are the key threats to the species.</p><p>There are no know threats towards this fish in The Gulf region. However, it should be noted that studies suggest that heavy aquaculture of this species is potentially leading to lower allele variation and less genetic diversity of aquacultured stocks when compared to wild-bred stocks (Yue <em>et al</em>. 2009), which breed-and-release programmes should be aware of and conduct further studies as to how this can lower genetic diversity in the wild.</p><p>A study published in 2010 showed that <em>L. calcarifer </em>fish caught off the southwestern coast of India revealed that this species has higher bioaccumulation of trace metals that other individuals of the same species inhabiting other waters in its range, and Cadmium had accumulated to toxic to human levels (Rejomon<em> et al.</em> 2010).</p>","No information is available on the population of this species across its range. The magnitude and timing of the wet season is likely to impact the juvenile success rate in this species. This is also a commercially fished species with harvest&#160; records suggesting that commercial catch peaked in 2011 (Saunders, Whybird and Newman 2016).<br/><strong><br/></strong><em>Lates calcarifer</em> is very well represented in museum collections, with 331 lots worldwide (FishNet2 retrieved 28 January 2014).<br/><br/>In Papua New Guinea in the late 1980s, Barramundi was ranked fourth in terms of both total fish production and foreign-exchange earnings (Opnai and Tenakanai 1987). The Barramundi catch represented ~80% of the total weight of commercial seafood sold in Daru in 1995 (Milton <em>et al</em>. 1998). In the early 1970s, commercial fishing vessels and artisanal fishers landed around 330 tonnes of <em>L. calcarifer</em> per year in just the Western province of Daru, around the Fly River region. However, intense local fishing depleted the local stock to the extent that the commercial fishing enterprises shut down in 1990 due to a lack of landings, most probably occurring because of stock depletion from over fishing (Milton <em>et al</em>. 1998).",Unknown,"This species is recorded from Indo-West Pacific;&#160;eastern edge of the Persian Gulf to China, Taiwan and southern Japan, southward to southern Papua New Guinea and northern Australia. In India, it is present in coastal brackish water areas of West Bengal, Orissa. It is probably not present in southern India. It has been recorded from Myanmar and Bangladesh.<strong><br/></strong>","This is a coastal, estuarine and freshwater species, and in India much of the catch is landed in winter. It enters estuaries and backwaters in pursuit of food and shelter but always returns to marine environments for spawning. Australian commercial fisheries generally cease fishing during the wet season (summer months) but this is managed by the different states or territories (e.g. Western Australia, Northern Territory and Queensland).<br/><br/>Juveniles of the species frequent the lower estuarine areas in the Hooghly-Matlah river system and enter impoundments along with the tidal water which acts as the main source of seed for brackish-water fish culture in impoundments popularly known as 'Bhasabadha' fishes in west Bengal. This prime estuarine perch comes into the Chilka Lake (Orissa) as young fish and back to the sea for breeding in June/July. This species is esteemed as a food fish. The maximum size attained is 150 cm; common size 45-60 cm. The airbladders are made into rough isinglass; marketed mostly fresh.<br/><br/><em>Lates calcarifer</em> is one of&#160; northern Australia's most important commercial fish species and is one of the most popular angling species (Allen <em>et al</em>. 2002). It is of huge commercial importance throughout its range as it is a very good tasting fish and it grows quickly (Larson 1999). Because of its high economic importance and commercial value, it is heavily aquacultured throughout its range,&#160;with most production in Southeast Asia, generally from small coastal cage farms. Often these farms will culture a mixture of species, including Barramundi, groupers (Family Serranidae, Subfamily Epinephelinae) and snappers (Family Lutjanidae).<br/><br/>Australia is experiencing the development of large-scale Barramundi farms that reflect the industrialized style of aquaculture seen in Europe. Where Barramundi farming is undertaken outside the tropics, recirculation production systems are often used (e.g. in southern Australia and in the north-eastern United States of America).<br/><br/>Barramundi has been introduced for aquaculture purposes to Iran, Guam, French Polynesia, the United States of America (Hawaii, Massachusetts) and Israel (FAO Fisheries and Aquaculture Fact Sheet).<br/><br/>It is also commercially fished throughout its range, mostly with gillnets (Larson 1999) and with rod-and-reel in recreational sport fishing (Larson 1999). Until 1990, less than 20,000 tonnes were harvested yearly, but by 1993, the landings totals doubled to over 40,000 tonnes per year. By the year 2,000, the total landings had increased to 75,000 tonnes and in 2010, the global landings had increased to over 100,000 tonnes (FAO Fisheries Statistics).&#160;<br/><br/>In The Gulf, Pakistan reported landing 600 tonnes of <em>&#160;L. calcarifer </em>and reaching 3,018 tonnes in 1982. However, in subsequent years, Pakistan's landing steadily decreased until 1999, when it reported landing just over 200 tonnes, and then Pakistan did not report landing any more of this species (FishStatJ Global Capture Statistics). Indonesia reports landing the most tonnage of this fish by far, reporting landing 12,438 tonnes in the East Indian Ocean and 85,257 tonnes from the Western-Central Pacific (FishStatJ Global Capture Statistics).",Freshwater (=Inland waters)|Marine,<p>Research into the&#160;species' taxonomy is suggested as this may be a&#160;species&#160;complex.<br/></p><p>Stocks are managed in northern Australia for both recreational and commercial fishing.</p>,Australasian|Indomalayan,NA,FALSE,FALSE,Global
