assessmentId,internalTaxonId,scientificName,redlistCategory,redlistCriteria,yearPublished,assessmentDate,criteriaVersion,language,rationale,habitat,threats,population,populationTrend,range,useTrade,systems,conservationActions,realm,yearLastSeen,possiblyExtinct,possiblyExtinctInTheWild,scopes
78908468,55892,Pseudacris crucifer,Least Concern,NA,2015,2015-08-25 00:00:00 UTC,3.1,English,"Listed as Least Concern in view of the large extent of occurrence, large number of sub-populations and localities, large population size and use of a wide range of habitats.","Typically it is found in moist wooded areas, especially near breeding pools. The species is mostly terrestrial and it hides under logs, rocks or other objects when inactive. Eggs are laid and larvae develop in small temporary or permanent waters of ponds (including those in fields with nearby forest), marshes, ditches and swamps, especially those with standing plants, sticks or other debris. Males call usually from among herbaceous vegetation adjacent to or standing in water. In northern Minnesota, successful reproduction in acidic bog water either does not occur or is a rare event (Karns 1992).","Wetland drainage reduces the available habitat. Although the species does not thrive in areas of urbanization and intense agriculture, it is moderately adaptable and not considered to face any major threats on a global scale.","There are thousands of sub-populations and millions of individuals, and the population is thought to be stable.",Stable,"This species occurs throughout the eastern USA and adjacent eastern Canada (east to Labrador; Bergman 1999), west to Manitoba, Minnesota, Iowa, eastern Kansas, Oklahoma, and eastern Texas (Conant and Collins 1991). It is absent from southern Florida. It was formerly believed to have been introduced in Cuba (Schwartz and Henderson 1991), but it has not been found there (Powell and Henderson 1999).","<p><span lang=""EN-US"">There are no records of this species being utilized.</p>",Terrestrial|Freshwater (=Inland waters),<strong><em>Conservation Actions</em></strong><br/>It occurs in many protected areas. There are no species-specific conservation actions needed.,Nearctic,NA,FALSE,FALSE,Global
79813410,57291,Pleurodema thaul,Least Concern,NA,2015,2015-07-10 00:00:00 UTC,3.1,English,"Listed as Least Concern in view of its wide distribution, tolerance of a broad range of habitats and presumed large population.","It is typically found in <em>Nothofagus</em> forest, but may also be found in steppe, grassland and transitional zones. It may also be found in urban areas, and in other altered habitats. Adults occur terrestrially in vegetation, below logs and below rocks. It reproduces in all types of waterbodies (although the species generally prefers shallow ponds). Free-swimming larvae characterize it.","There are no major threats to this adaptable species, though a number of sub-populations are impacted by fires, water pollution (by both agriculture and industry) and habitat desiccation due to droughts or land use change.",It is a very abundant species within its preferred habitat. This is the most common frog in Chile.,Stable,"This species is widely distributed in Chile from the northern arid territories to the southern <em>Nothofagus</em> forest and from sea level to the vegetation line in the Andes range western slopes of Central Chile. In Argentina, it is widely distributed from the western shore of Laguna Superior de Epulafquen, Departamento Minas (Neuquén) south to the area between La Plata and La Chico lakes, Departamento Río Senguer (Chubut). Its origin is uncertain in Antofagasta, where it has probably been introduced but has not been mapped for this species. It has been introduced in Isla Robinson Crusoe, Archipelago Juan Fernandez. It has an altitudinal range of 0-3,100 m asl.",There are no records of this species being utilized.,Terrestrial|Freshwater (=Inland waters),It occurs in many protected areas.,Neotropical,NA,FALSE,FALSE,Global
82961225,62209,Cyprinodon macularius,Vulnerable,"B1ab(ii,iii)+2ab(ii,iii)",2019,2019-02-08 00:00:00 UTC,3.1,English,"This species is listed as Vulnerable because the extent of occurrence may be less than 20,000 km<sup>2</sup>, area of occupancy probably does not exceed 2,000 km<sup>2</sup>, the distribution is severely fragmented, viable naturally occurring populations occur in very few locations, and the population is subject to continuing declines from ongoing threats from habitat loss/alteration in addition to effects of non-native species.","Habitat includes desert springs and outflow marshes, river-edge marshes, lakes, backwaters, saline pools, and stream pools, usually in areas with sand/silt substrates and aquatic plant life, limited surface flow, and water less than 1 meter in depth. Its original habitat was probably marshes and flood plain pools along the lower Colorado River and springs throughout the Salton Sink (Lee <em>et al</em>. 1980, Moyle 2002, Page and Burr 2011). This fish tolerates low oxygen levels, high temperatures, and high salinity. Males establish small territories prior to spawning, usually in water less than 1 meter deep (sometimes deeper). Eggs are laid on substrate of sand, mud, or perhaps preferentially on algal mat (Schoenherr 1988).<br/><br/>Most re-established populations are in human-constructed environments (USFWS 2010).","Populations are now drastically reduced due to marsh drainage, groundwater mining, deforestation, overgrazing, agricultural use of water, dam building, real estate development, encroachment by non-native vegetation such as <em>Tamarix </em>(Schoenherr 1988), pesticide blowover, and perhaps most importantly, introduction of exotic predators and competitors (especially <em>Tilapia zilli</em>, <em>Oreochromis </em>spp., and mosquitofish).<br/><br/>Threats identified at the time of listing and in the recovery plan continue unabated. New non-native aquatic species continue to establish within the Desert Pupfish's range, and previously existing nonnative species increase in numbers and distribution (Minckley and Marsh 2009). Human demands for water are unending, with the Salton Sea and Lower Colorado River suffering water level declines and the associated threats to the Desert Pupfish from water depletion, such as habitat loss, fragmentation, and degradation of habitat quality still ongoing. Water availability to the Desert Pupfish will continue to interact with predicted trends for warmer, drier, and more extreme hydrological conditions associated with climate change (USFWS 2010).<br/><br/>This species is relatively intolerant of competition and predation; it is easily displaced by introduced fishes. It is tolerant of a limited amount of nondestructive intrusion (e.g. swimming), but reproduction can easily be disrupted.","This species is represented by 4 naturally occurring metapopulations in 11 known locations (USFWS 2010). However, only one naturally occurring population (San Felipe Creek, California) is relatively secure (USFWS 2010). About 16 transplanted populations exist in the wild (all in Arizona); the number fluctuates with establishment and failure of populations (Moyle 2002). Long-term viability of these populations is uncertain (USFWS 2010).<br/><br/>Total adult population size is unknown but presumably exceeds 1,000,000; the population at Cerro Prieto is apparently large. USFWS (2010) reported that over 1,000,000 desert pupfish have been relocated to other extant populations from USGS experimental ponds in recent years.<br/><br/>This species underwent a drastic, well-documented decline after 1950, particularly after 1970 in the Salton Sea region (Minckley and Deacon 1991). Hendrickson and Varela (1989) estimated that about 95% of the habitat has been lost in the past century. Present historical range represents only a small, peripheral, and fragmented portion of the species' former distribution within the lower Colorado and Gila River systems (USFWS 2010). The populations in and around the Salton Sea irrigation drains and shoreline pools wax and wane over time (Martin and Saiki 2005).<br/><br/>The population as a whole is presently stable in terms of distribution, though it is still small, disjunct, and vulnerable to stochastic events that could result in local extirpations; local populations may be far more variable due to a variety of factors such as amount of habitat, presence of nonnative species, and other threats (USFWS 2010).",Decreasing,"Historical range included the lower Colorado and Gila river drainages, southern Arizona to southeastern California, and the Salton Sea and Laguna Salada basins, California and Mexico (Minckley and Marsh 2009). Currently this pupfish occurs in California in the Salton Sink (San Felipe Creek/San Sebastian Marsh, upper Salt Creek, and shoreline pools and irrigation drains of Salton Sea, California); El Doctor (3 localities) and Santa Clara Slough (=Cienega de Santa Clara; 2 localities), Sonora, Mexico; Laguna Salada, Baja California, Mexico; and Cerro Prieto (2 localities), Baja California, Mexico (USFWS 2010; see also Hendrickson and Varela Romero 1989, Echelle <em>et al.</em> 2000, Minckley and Marsh 2009). No naturally occurring populations of <em>Cyprinodon macularius</em> remain in Arizona (Minckley <em>et al. </em>1991), but several reintroduced populations exist. The species has been introduced in areas outside the native range and several populations exist in artificial refugia.",This species is of minor value in commercial aquaria.,Freshwater (=Inland waters),"Introductions into marginal, semi-natural, relatively stable habitats have not been especially successful; recovery planners should consider use of riverine habitat and manipulations of flows or other disturbances (Hendrickson and Varela 1989). See Meffe and Vrijenhoek (1988) for a discussion of conservation genetics.<br/><br/>A population at the Dexter National Fish Hatchery in New Mexico is being used for reintroduction efforts in Arizona; these fishes are derived from Santa Clara Slough. See Hendrickson and Brooks (1991) for information on transplantation efforts. <br/><br/>As of 1990, a barrier to block movements of tilapia was planned or underway at San Felipe Creek, Imperial County, California (California Department of Fish and Game 1990). San Felipe Creek and Salt Creek populations are regularly monitored by California Dept. of Fish and Game (California Department of Fish and Game 1990).<br/><br/>Current distribution and abundance need further study, especially in Mexico; all populations warrant regular monitoring. <br/><br/>Development of land adjacent to San Felipe Creek should be prevented. Management of refuges and San Felipe Creek for pupfish should be continued. Exotic fishes and predators should be excluded from habitat.",Nearctic,NA,FALSE,FALSE,Global
86178858,185127,Lipophrys trigloides,Least Concern,NA,2014,2007-11-14 00:00:00 UTC,3.1,English,"<strong>Global Assessment:&#160;</strong>This species is widespread and common. It is threatened by pollution and coastal development, however, declines do not reach thresholds for threatened categories. This species is listed as Least Concern.<br/><br/><strong>European Regional Assessment:&#160;</strong><em>Paralipophrys triloides</em>&#160;is widespread and common in the eastern Atlantic Ocean and most parts of the Mediterranean Sea. The population appears stable and it has no widespread threats. Therefore,<em>&#160;P. trigloides</em>&#160;is considered Least Concern.","This is a shallow water species which inhabits rocky shores (Bath 1990). It may remain out of water under rocks and seaweeds where it can breathe air (Martin and Bridges 1999). This species is very inactive except during spawning. It feeds on mussels, other benthic invertebrates and algae (Zander 1986). This is the only known nocturnally active combtooth blenny (Nieder and Zander 1993).",Major threats to this species include habitat loss due to pollution and coastal development.,This is a common species with a stable population.,Stable,"<em>Lipophrys trigloides </em>is widely distributed in the eastern Atlantic, from Portugal south to Guinea. In the northeastern Atlantic,<em> </em>the species is found along the coasts of Portugal, Spain, and Morocco, including the Canary Islands. It is also present in all parts of the Mediterranean Sea except parts of the north African coast, the Sea of Marmara, and the western Black Sea (Zander 1986). The species is also found in the Balearic Islands - Ibiza (Fischer&#160;<em>et al</em>.&#160;2007). It is typically found to 15 m depth (Zander 1986).",This species is not utilized.,Marine,"No species specific conservation measures are in place for <span style=""font-style: italic;"">Paralipophrys trigloides</span>. However, its range may overlap with several marine protected areas (World Database on Protected Areas 2010).",NA,NA,FALSE,FALSE,Global
86595684,54655,Rhinella granulosa,Least Concern,NA,2010,2008-12-01 00:00:00 UTC,3.1,English,"Listed as Least Concern in view of its wide distribution, tolerance of a broad range of habitats, presumed large population, and because it is unlikely to be declining to qualify for listing in a more threatened category.","This taxon mainly inhabits open areas, savannahs, forests, river shorelines, and reproduces explosively in permanent and temporary waterbodies. By day, specimens hide in holes in the ground. Its presence in forests is apparently due to colonization of intervened habitats along roads and penetration tracks; it has been reported from urban areas in Bolivia. Breeding and larval development takes place in ponds. It can be found breeding in very small and shallow puddles (Lynch 2006). Time of larvae development is 30 days. It feeds on ants and termites.",There are no major threats to this adaptable species. It is sometimes found in the international pet trade but at levels that do not currently constitute a major threat.,This is a very common species.,Stable,"This species occurs throughout much of the Amazonian Basin, from Western Pacific lowlands, central Panama and eastern lowlands adjacent to central Panama, through the Guianas, south through the Orinoco and Caribbean regions of Colombia, Margarita Island (Venezuela), Bolivian lowlands, throughout much of Brazil, northwestern Paraguay and northern Argentina. It is not present in Trinidad and Tobago, Ecuador, Peru or Uruguay. Altitudinal range is up to 1,500 m asl.",NA,Terrestrial|Freshwater (=Inland waters),It is in protected areas throughout most of its range.,Neotropical,NA,FALSE,FALSE,Global
97431862,170502,Mauremys reevesii,Endangered,A2bcd+4bcd,2011,2011-03-21 00:00:00 UTC,3.1,English,"<span style=""font-style: italic;"">Mauremys reevesii</span> has become subject to intensive exploitation for food and medicine and to supply the aquaculture industry with breeding animals, as well as being extensively impact by habitat degradation and loss; it has declined to extinction across most of its range in P.R. China, with only outlying (and possibly historically introduced) populations in Taiwan (offshore islands only) and Japan remaining at reasonably original densities. Generation time is estimated at a minimum of 10 years. Over the past 30 years the species has disappeared from at least half its original area of occurrence as a result of targeted collection, and collection pressures continue, qualifying the species for EN A2bcd+A4bcd.<span style=""font-style: italic;""></span>","<span style=""font-style: italic;"">Mauremys reevesii</span> is a generalist inhabitant of vegetated shallow lowland ponds, pools and marshes, including wetlands in agricultural landscapes if the species is not collected. It feeds on a variety of plant and small animal matter, with snails possibly representing a significant part of the diet of mature females.<br/><br/>Males rarely exceed 11 cm carapace length (CL), females can reach up to 24 cm CL. Females reach maturity in about five to six years in captivity and may produce several clutches of three to five eggs annually; reproductive data of wild populations appear unreported.","Wild populations of <span style=""font-style: italic;"">Mauremys reevesii </span>are threatened first and foremost by intensive targeted collection to supply the consumption, medicinal and aquaculture supply trades.<br/><br/>In addition,    habitat destruction and degradation due to urbanization and pollution is also an important threat for this lowland species.","Historically a common and widespread species, <span style=""font-style: italic;"">Mauremys reevesii</span> is now a rare species in the wild. The species is commercially farmed in vast quantities in P.R. China and captive populations likely amount to millions of individuals.",Unknown,"<span style=""font-style: italic;"">Mauremys reevesii</span> is native to most of temperate and subtropical China, North Korea and South Korea; populations also occur in Taiwan, Hong Kong and Japan, though these may be historic introductions by humans (Fong and Chen 2010). Populations recorded from Timor (Indonesia), Timor Leste and Palau certainly originated from human introductions.","<span style=""font-style: italic;"">Mauremys reevesii</span> traditionally was widely used and traded for medicinal purposes, the plastron bones being used in Traditional Chinese Medicine. As wild supplies dwindled, aquaculture of the species expanded greatly since the early 1990s.",Terrestrial|Freshwater (=Inland waters),"<span style=""font-style: italic;"">Mauremys reevesii</span> is listed in CITES Appendix III (China). Assurance colonies (comprising animals of generally unknown geographic origin and genetic profile) and large-scale commercial farm holdings will ensure that the species itself will not go extinct anytime soon, but it has already disappeared as a common landscape species across most of its range; its best prospects for survival in the wild lies in strict protection and appropriate management of lowland wetland protected areas within its original range, and eventually re-introduction into regions where the species has been extirpated by overexploitation.",Indomalayan|Palearctic,NA,FALSE,FALSE,Global
97802083,5445,Cottus gobio,Least Concern,NA,2011,2010-03-05 00:00:00 UTC,3.1,English,"A widespread species with no known major widespread threats, however several populations are locally threatened. Future research on <em>C. gobio</em> is likely to show that it is in fact an assemblage of several species and each should be re-evaluated.<br/><br/>    <p>European Union 27 = LC. Same rationale as above.</p>","<strong>Habitat</strong>: <br/>Cold, clear and fast-flowing water of small stream to medium-sized rivers. As well on gravel or rocky shores of cold lakes and in slightly brackish waters along eastern Baltic coast. <br/><br/><strong>Biology</strong>: <br/>Spawns for the first time at 2-4 years. Spawns in March-April, when temperature rises above 12°C. Females spawn once a year. Most individuals spawn for several years. They lay adhesive eggs in a compact clutch on ceiling of small cavities in gravel or rock bottom. Males guard eggs until hatching; a single male may guard the egg clutches of several females. Feeds on a wide variety of benthic invertebrates.",No major threats known.,Abundant.,Unknown,"Northern Baltic basin in Scandinavia south to stream Maurine (53°51'N 10°56'E) in southwesternmost corner of Baltic basin (Germany). Lower reaches of streams and rivers and along coast of Sweden, Finland, Russia southwest to Estonia. Danube (except upper tributaries Save and Arges), Elbe, Ems, Weser and Rhône drainages. Tributaries of upper Rhine downriver (northward) to about Mannheim. A few of the uppermost tributaries of River Tevere, Central Italy. Adriatic drainages, from Potenza (Italy) to Zrmanja (Croatia), except Timavo spring (inhabited by <em>C. scaturigo</em>). mtDNA and microsatellite data show that sculpins from the stream Steenputbeek (4°17'N 50°43'E) in Scheldt drainage represent <em>C. gobio</em>, suspected to be introduced. Sculpins reported from Neretva drainage (Bosnia-Herzegovina) probably also belong to <em>C. gobio</em>.",NA,Freshwater (=Inland waters),No information available.,Palearctic,NA,FALSE,FALSE,Global & Europe
101430867,57193,Odontophrynus occidentalis,Least Concern,NA,2019,2017-12-18 00:00:00 UTC,3.1,English,"Listed as Least Concern in view of its wide distribution, tolerance of a degree of habitat modification, and presumed large population.","This species can be found in montane forests, rocky outcrops, and scrub habitats. It reproduces in permanent streams. The larvae remain in streams where metamorphosis occurs after about eight months. It tolerates substantial habitat destruction.","Although this species is tolerant of habitat disturbance, it is still threatened by water pollution and fires caused by agricultural and mining activities.","It is less common than other <em>Odontophrynus</em> in Argentina, but regularly recorded. The population is presumed to be stable.",Stable,"This species occurs in central and south-central Argentina. It has an elevational range of 50-1,500 m asl.&#160;Based on&#160;a revision of several herpetological collections,&#160;many specimens from La Rioja, Catamarca and San Juan provinces previously reported in the literature as this species&#160;have now been assigned to&#160;<em>Odontophrynus barrioi </em>(Rosset&#160;<em>et al.&#160;</em>2007).",There are no records of this species being utilized.,Terrestrial|Freshwater (=Inland waters),"<strong><em>Conservation Actions In-Place</em></strong><br/>It occurs in the Pampa de Achala Regional Hydrological Reserve in Cordoba province.<br/><br/><strong><em>Conservation Needed</em></strong><br/>Mitigation of pollution events is required at sites where this species is known to occur.<br/><br/><strong><em>Research Needed</em></strong><br/>More information is needed on this species' taxonomy, population status, and trends.",Neotropical,NA,FALSE,FALSE,Global
